"tissue","story","cluster_n"
"duodenum","The integrative analysis of the metabolomics data from our case versus control comparison reveals a complex and interconnected metabolic landscape, characterized by significant functional clustering across diverse biochemical pathways. Despite the absence of structurally characterized metabolites anchoring these clusters, the MS2 functional clustering approach has illuminated potential metabolic cross-talk and compensatory mechanisms that could underlie the observed physiological changes associated with the condition under study.

The identified clusters suggest a dynamic interplay between lipid metabolism, amino acid processing, and oxidative stress responses. The convergence of glycerophospholipid metabolism, both in neuronal signaling and immune response, with fatty acid and cardiolipin biosynthesis, highlights a coordinated effort to maintain membrane integrity and functionality. This coordination is crucial for cellular signaling and energy homeostasis, particularly under conditions of metabolic stress. The involvement of phospholipase enzymes and lipid mediators suggests an adaptive response to modulate membrane dynamics and signal transduction, potentially reflecting a compensatory mechanism to counteract cellular damage or stress.

Carotenoid metabolism, although represented by structurally uncharacterized metabolites, appears to play a role in oxidative stress response and membrane stability. This is complemented by the glutathione metabolism cluster, which underscores the importance of redox balance in cellular defense mechanisms. The presence of metabolites related to antioxidant pathways suggests that the condition may induce oxidative stress, necessitating enhanced protective measures to preserve cellular homeostasis.

The integration of arginine and proline metabolism with lysine degradation and oligopeptide metabolism further illustrates the intricate network of amino acid processing pathways. These pathways are critical for nitrogen balance, protein synthesis, and cellular signaling, and their modulation may reflect an adaptive response to altered metabolic demands or stress conditions. The potential involvement of nitric oxide synthesis and polyamine production in these clusters suggests a broader impact on vascular regulation, immune response, and tissue repair processes.

The physiological context of these findings points to a systemic metabolic phenotype characterized by enhanced lipid remodeling, amino acid turnover, and oxidative stress management. The cross-talk between these pathways likely facilitates organ-specific adaptations, with potential implications for tissue-specific effects such as neuronal signaling, immune modulation, and mitochondrial function. The observed metabolic rewiring may reflect an underlying mechanism of disease progression or adaptation, where the body attempts to maintain homeostasis in the face of metabolic perturbations.

Embracing the unknowns within these clusters, the structurally uncharacterized metabolites may represent novel intermediates or biomarkers that are pivotal in the condition's pathology. Their functional similarity, as revealed by MS2 clustering, suggests they play significant roles in the identified pathways, offering new avenues for research into their precise biological functions and potential therapeutic targets.

In conclusion, the metabolic rewiring observed in this study suggests a hypothesis where the condition drives a coordinated response involving lipid and amino acid metabolism, oxidative stress management, and membrane dynamics. This systemic adaptation may serve to mitigate cellular damage and maintain homeostasis, providing insights into the underlying mechanisms of the disease and highlighting potential targets for intervention. The integration of these findings into a broader physiological framework underscores the complexity of metabolic regulation and the potential for discovering novel biomarkers and therapeutic strategies.",11
"facial_skin","In this study, we leveraged MS2 functional clustering to uncover two distinct yet potentially interconnected metabolic modules: cephalosporin biosynthesis and phosphatidylcholine biosynthesis. While each cluster elucidates separate biochemical pathways, their integration provides a comprehensive view of the metabolic phenotype characteristic of the condition under investigation. The cephalosporin biosynthesis module, despite the absence of structurally identified metabolites, suggests a robust engagement in antibiotic production pathways. The inferred presence of 7-Aminocephalosporanic acid within this cluster underscores its pivotal role as a precursor in cephalosporin synthesis, hinting at an active engagement in antimicrobial defense mechanisms. The potential involvement of acetyltransferase CD1211 further implies acetylation processes that could be critical in modifying cephalosporin precursors, thereby enhancing their antibacterial efficacy.

Simultaneously, the phosphatidylcholine biosynthesis module, although lacking known metabolites, suggests alterations in membrane lipid composition. The presence of PE-NMe2(18:0/22:4(7Z,10Z,13Z,16Z)) indicates active phosphatidylcholine synthesis, which is essential for maintaining membrane integrity and fluidity. This process is crucial for cellular signaling and membrane trafficking, potentially affecting cellular responses to environmental stressors and inflammatory signals. The functional overlap between these modules may indicate a compensatory mechanism where enhanced membrane remodeling supports the structural and energetic demands of cephalosporin biosynthesis.

The metabolic cross-talk between these modules suggests a broader physiological adaptation. The cephalosporin biosynthesis pathway may be upregulated in response to microbial threats, necessitating increased phosphatidylcholine production to maintain cellular membrane integrity during heightened biosynthetic activity. This interplay highlights a potential feedback loop where the demand for antibiotic production influences lipid metabolism, ensuring that cellular membranes remain functional and responsive under stress conditions. Such a dynamic balance could be particularly relevant in tissues with high metabolic activity or those exposed to frequent microbial challenges, such as the liver or gut.

In the broader physiological context, the observed metabolic phenotype may reflect a systemic response to infection or inflammation, characterized by enhanced antimicrobial synthesis coupled with membrane lipid remodeling. This suggests a coordinated effort across organs to bolster defense mechanisms while maintaining cellular homeostasis. The presence of structurally uncharacterized metabolites within both clusters emphasizes the potential for novel pathway intermediates or biomarkers that could offer deeper insights into the metabolic adaptations underlying the condition. These unknown metabolites, identified through functional similarity, may represent key nodes in the metabolic network, offering new avenues for therapeutic intervention or biomarker discovery.

The integration of these metabolic modules provides a hypothesis for the underlying mechanism of the condition: a metabolic rewiring that prioritizes antimicrobial defense and membrane integrity. This adaptive response may be driven by a need to enhance cellular resilience against pathogenic threats while preserving essential cellular functions. The interplay between cephalosporin and phosphatidylcholine biosynthesis pathways underscores the complexity of metabolic regulation, where multiple pathways converge to support organismal health. As we continue to explore these functional modules, the identification of structurally uncharacterized metabolites will be crucial in unraveling the intricate metabolic networks that define disease states, offering new insights into potential therapeutic targets and diagnostic markers.",2
"fallopian_tube","The integrative analysis of the metabolomic data from the case versus control comparison, utilizing MS2 functional clustering, reveals a complex interplay of metabolic pathways that underpin the physiological phenotype observed in the condition under study. The identified functional modules, despite the lack of structurally characterized metabolites, provide a rich tapestry of metabolic interactions that suggest significant biochemical rewiring.

At the core of this metabolic network lies the glycerophospholipid metabolism, which is intimately linked to membrane dynamics and signaling pathways. This module's interaction with glutathione metabolism suggests a compensatory mechanism where oxidative stress, potentially exacerbated by altered lipid signaling, is mitigated through enhanced antioxidant activity. The presence of lipid peroxidation products, such as 4-Hydroxynonenal glutathione, underscores this protective response, highlighting a feedback loop aimed at maintaining cellular integrity under stress conditions.

The dopamine beta-hydroxylase deficiency pathway, although primarily associated with neurotransmitter synthesis, may intersect with nicotinate and nicotinamide metabolism, suggesting a broader systemic impact on energy homeostasis and redox balance. The involvement of organosulfur compounds and potential cannabinoid interactions hints at a complex modulation of neurological and immune responses, which could reflect adaptive changes in neurotransmitter regulation and cellular signaling in response to the condition.

Purine metabolism, with its emphasis on nucleotide synthesis and salvage, interacts with nicotinate and nicotinamide pathways, indicating a shared reliance on nucleotide pools for energy and redox reactions. This cross-talk may be particularly relevant in tissues with high proliferative demands or under oxidative stress, where efficient nucleotide recycling becomes critical. The inferred presence of nucleotide derivatives suggests potential novel intermediates that could serve as biomarkers for cellular proliferation and stress responses.

Bile acid biosynthesis, primarily occurring in the liver, exemplifies organ-specific metabolic adaptation. Its interaction with glycerophospholipid metabolism may influence systemic lipid homeostasis and nutrient absorption, reflecting a coordinated response to maintain metabolic balance. The potential involvement of cholesterol derivatives in bile acid formation highlights the liver's role in modulating lipid metabolism, which may have downstream effects on other tissues, such as the intestine, through altered nutrient uptake.

Biotin metabolism, essential for carboxylase enzyme function, intersects with glutathione and purine pathways, suggesting a role in supporting cellular growth and detoxification processes. The potential disruptions in biotin-dependent reactions could impact energy metabolism, particularly in tissues with high metabolic demands, such as the liver and muscle, thereby influencing overall metabolic flexibility.

The metabolism of Trandolapril, an ACE inhibitor, further illustrates the systemic nature of these metabolic changes. Its interaction with glutathione metabolism may reflect an adaptive response to modulate drug efficacy and mitigate potential oxidative stress associated with hypertension treatment. This highlights the importance of understanding drug metabolism in the context of broader metabolic networks, which could inform therapeutic strategies.

Collectively, these functional modules depict a metabolic phenotype characterized by enhanced lipid signaling, oxidative stress management, and nucleotide recycling, reflecting a systemic response to maintain homeostasis under the disease condition. The structurally uncharacterized metabolites, while enigmatic, offer tantalizing clues about novel pathway intermediates or biomarkers that could illuminate the underlying mechanisms. This metabolic rewiring suggests a condition marked by disrupted energy homeostasis, oxidative stress, and altered neurotransmitter regulation, providing a foundation for future research to unravel the complexities of the disease and identify potential therapeutic targets.",8
"femoral_vein","The integration of metabolomic data from the case versus control comparison using MS2 functional clustering reveals a complex interplay between steroid hormone biosynthesis and acylaminosugar metabolism, suggesting a systemic metabolic reprogramming in response to the condition under investigation. The two identified functional modules, despite being composed entirely of structurally uncharacterized metabolites, offer compelling insights into the metabolic phenotype and potential pathophysiological mechanisms at play.

The steroid hormone biosynthesis cluster, characterized by metabolites inferred to possess steroidal structures, indicates an upregulation of steroidogenic activity. This is particularly relevant given the critical roles steroid hormones play in regulating metabolism, immune responses, and homeostatic balance. The presence of these metabolites in blood samples suggests alterations in pathways such as the hypothalamic-pituitary-adrenal (HPA) axis, which could be driving changes in systemic steroid levels. Such alterations may impact membrane dynamics and inflammatory signaling, processes known to be modulated by steroid hormones. The absence of structurally identified metabolites in this cluster underscores the potential for discovering novel intermediates or regulatory compounds that may serve as biomarkers for the condition.

Conversely, the acylaminosugar metabolism cluster highlights a potential shift in sugar modification pathways, which are crucial for cellular communication and immune interactions. The inferred presence of lipopolysaccharide-like compounds suggests a heightened state of immune vigilance, possibly as a response to pathogenic stimuli or cellular stress. This metabolic reprogramming could reflect a compensatory mechanism to maintain cellular integrity and defense, particularly in tissues exposed to external challenges. The functional similarity of these unknown metabolites to known sugar derivatives involved in signaling pathways further supports their role in modulating cellular responses and metabolic fluxes.

The cross-talk between these functional modules suggests a coordinated metabolic response to the condition. The upregulation of steroid hormone biosynthesis could be compensating for increased immune activity driven by acylaminosugar metabolism, potentially creating a feedback loop that balances metabolic demands with immune readiness. This interplay may be particularly pronounced in tissues with high metabolic and immune activity, such as the liver and adrenal glands, indicating organ-specific adaptations and cross-talk in response to systemic changes.

The overall metabolic phenotype emerging from this analysis is one of heightened metabolic and immune activity, potentially reflecting an adaptive response to maintain homeostasis under stress or disease conditions. The structural unknowns within these clusters, while challenging, represent an exciting frontier for discovery. They may reveal novel intermediates or regulatory molecules that bridge known pathways, offering new avenues for therapeutic intervention and biomarker development.

In conclusion, the metabolic rewiring observed in this study suggests a condition-driven enhancement of steroidogenesis and immune-related sugar metabolism, reflecting a complex adaptive response. This systemic reprogramming highlights the potential for novel pathway intermediates to play pivotal roles in disease progression and response. Future studies aimed at structurally characterizing these unknown metabolites will be crucial in elucidating their precise biological functions and contributions to the observed metabolic phenotype. This work underscores the power of functional metabolomics in revealing intricate metabolic networks and their implications for health and disease.",2
"frontal_pole","The integration of metabolomics data from our case versus control study reveals a complex interplay between glycerophospholipid and iron metabolism, underscoring a systems-level metabolic phenotype that might be pivotal in the underlying condition. Although the clusters identified through MS2 functional clustering are composed predominantly of structurally uncharacterized metabolites, their functional associations provide compelling insights into the metabolic rewiring occurring in the disease state.

Glycerophospholipid metabolism, represented in Cluster 2, is integral to maintaining cellular membrane integrity and facilitating critical cellular functions such as signal transduction and energy homeostasis. The inferred involvement of diacylglycerol kinase activity and cardiolipin metabolism suggests a disruption in mitochondrial function, potentially affecting energy production and apoptosis regulation. This disruption may be linked to the systemic alterations observed in blood, impacting processes like smooth muscle function and sensory responses. The presence of unknown metabolites in this cluster, while initially a challenge, offers a tantalizing glimpse into novel intermediates or regulatory molecules that could be pivotal in maintaining mitochondrial membrane stability and function.

In parallel, Cluster 1 highlights the intricate regulation of iron metabolism, a process crucial for cellular functions such as oxygen transport and electron transport. The functional evidence pointing to interactions with iron storage and redox balance suggests a compensatory mechanism attempting to mitigate oxidative stress and maintain cellular homeostasis. The interplay between iron metabolism and lipid signaling, as indicated by the presence of functionally related but structurally uncharacterized metabolites, underscores a potential feedback loop where lipid dynamics influence iron transport and vice versa. This cross-talk may be particularly relevant in tissues with high metabolic demands, where iron and lipid metabolism are tightly regulated to prevent oxidative damage and support cellular function.

The overall metabolic phenotype emerging from this study suggests a condition characterized by disrupted energy homeostasis and oxidative stress, potentially manifesting in tissue-specific effects such as altered mitochondrial function and compromised cellular signaling. The systemic presence of these metabolic alterations in blood indicates organ cross-talk, where dysregulation in one tissue might propagate through metabolic intermediates to affect others, creating a cascade of physiological changes.

Embracing the unknowns within these clusters, we propose that the structurally uncharacterized metabolites may represent novel pathway intermediates or biomarkers, offering new avenues for understanding the disease mechanism and potential therapeutic targets. Their functional similarity, as revealed by MS2 clustering, suggests they play significant roles in the observed metabolic alterations, and further characterization could provide deeper insights into their biological significance.

In conclusion, the metabolic rewiring observed in this study highlights a potential mechanism where disrupted glycerophospholipid and iron metabolism converge to affect cellular energy balance and oxidative stress management. This convergence may drive the pathophysiological changes associated with the condition, offering a new perspective on disease progression and potential intervention points. The identification of these functional modules, despite the structural unknowns, emphasizes the power of systems biology approaches in uncovering the complex networks underlying health and disease.",2
"heart","The integrative analysis of the metabolomic data from our case versus control comparison reveals a complex interplay of metabolic pathways, suggesting a systemic metabolic phenotype characterized by dysregulated lipid, amino acid, and energy metabolism. The clustering of metabolites into functional modules, despite the absence of structurally characterized compounds, provides a unique opportunity to explore the metabolic landscape through inferred functional associations. This systems-level perspective highlights the interconnectedness of metabolic processes and their potential implications for disease pathology.

The bile acid biosynthesis cluster, despite its lack of known metabolites, points to alterations in lipid metabolism and steroid pathways. This cluster's inferred involvement in lipid signaling and steroid hormone pathways suggests a potential disruption in cholesterol homeostasis and enterohepatic circulation, which could have systemic effects on energy metabolism and inflammatory responses. The proline metabolism cluster, similarly composed of unknown metabolites, indicates shifts in amino acid cycling and peptide signaling, which are critical for cellular stress responses and nitrogen balance. These changes may reflect compensatory mechanisms to maintain cellular homeostasis under stress conditions, potentially impacting membrane integrity and osmotic stress responses.

The ethanol degradation cluster further underscores the complexity of metabolic cross-talk, with its emphasis on oxidative processes that may generate reactive oxygen species, leading to oxidative stress. The presence of functionally related metabolites suggests potential antioxidant roles, highlighting a feedback loop where increased oxidative stress could trigger protective metabolic pathways. This interplay between ethanol metabolism and oxidative stress pathways may also intersect with lipid metabolism, as oxidative stress can influence lipid peroxidation and membrane dynamics.

Tryptophan metabolism, a critical pathway for neurotransmitter synthesis and immune regulation, emerges as another key player in this metabolic network. The inferred involvement in protein synthesis and glycosylation processes suggests a broader role in cellular repair and signaling. This cluster's potential link to the kynurenine pathway, known for its role in immune regulation and neuroactive compound synthesis, may provide insights into the disease's impact on immune function and neurological health.

Folate metabolism, essential for nucleotide synthesis and methylation processes, is intricately linked with amino acid and nitrogen metabolism. The inferred functional roles of unknown metabolites in this cluster suggest a potential impact on cellular proliferation and repair, with implications for tissue growth and regeneration. The lipid metabolism cluster, with its focus on membrane dynamics and signaling, further emphasizes the importance of lipid homeostasis in maintaining cellular integrity and function.

Collectively, these findings suggest a metabolic phenotype characterized by disrupted lipid and amino acid metabolism, oxidative stress, and altered energy homeostasis. The cross-talk between these pathways indicates a systemic response to the disease condition, potentially involving organ-specific effects such as liver dysfunction and altered gut-liver axis communication. The presence of numerous structurally uncharacterized metabolites, identified through functional clustering, underscores the potential for discovering novel pathway intermediates or biomarkers that could provide new insights into the disease mechanism.

Our hypothesis posits that the observed metabolic rewiring reflects an adaptive response to maintain homeostasis in the face of metabolic stress, with implications for energy balance, immune function, and cellular integrity. This metabolic adaptation may represent a compensatory mechanism to counteract the disease's effects, providing a potential therapeutic target for modulating these pathways to restore metabolic balance. The integration of these functional modules into a cohesive metabolic network offers a promising avenue for understanding the underlying mechanisms of the condition and identifying novel intervention strategies.",6
