"tissue","story","cluster_n"
"hippocampus","The integrative analysis of the metabolomic data reveals a complex landscape of metabolic alterations that underscore the intricate biochemical interplay between various pathways in the case group compared to controls. This study, leveraging MS2 functional clustering, has elucidated five distinct yet interconnected metabolic modules, each contributing to a broader understanding of the underlying physiological changes.

The phenylalanine metabolism cluster, despite lacking structurally characterized metabolites, suggests profound implications for neurotransmitter biosynthesis and nitrogen metabolism. The inferred presence of metabolites related to phenylalanine catabolism indicates potential disruptions in neurotransmitter synthesis pathways, which could have significant ramifications for neurological function and cellular communication. This disruption may be further exacerbated by alterations in arginine and proline metabolism, where the urea cycle and nitric oxide pathways are implicated. The cross-talk between these pathways suggests a compensatory mechanism where the dysregulation of neurotransmitter synthesis might be partially offset by changes in nitric oxide production, impacting vascular function and immune responses.

Carnitine metabolism emerges as another critical node, with potential disruptions in fatty acid transport and energy production. The inferred functional evidence points to a compromised carnitine shuttle, which could lead to impaired mitochondrial function and energy dysregulation. This metabolic stress might be linked to alterations in bile acid biosynthesis, where the modification and transport of bile acids are suggested. The interplay between lipid metabolism and bile acid pathways highlights a potential feedback loop where impaired fatty acid oxidation could influence bile acid synthesis, affecting lipid absorption and systemic energy balance.

Aminoacyl-tRNA biosynthesis, pivotal for protein synthesis, shows potential disruptions in amino acid processing and peptide formation. The involvement of metabolites linked to amino acid metabolism and peptide synthesis suggests that these alterations could contribute to dysregulated protein synthesis, particularly in disease contexts like cancer. The potential cross-talk with tryptophan metabolism further underscores the complexity of these interactions, possibly influencing cellular signaling and immune function.

Collectively, these findings suggest an overall metabolic phenotype characterized by disrupted energy homeostasis, altered neurotransmitter and nitric oxide signaling, and impaired protein synthesis. The tissue-specific effects likely span the liver, where bile acid and amino acid metabolism are central, and the brain, where neurotransmitter synthesis is critical. Organ cross-talk, particularly between the liver and brain, may be pivotal in mediating the physiological manifestations of the condition.

The presence of structurally uncharacterized metabolites, while challenging, offers a unique opportunity to explore novel pathway intermediates or biomarkers. The functional similarity inferred from MS2 clustering provides a window into their likely biological roles, suggesting that these unknowns may represent key nodes in the metabolic network that warrant further investigation.

In conclusion, the metabolic rewiring observed in this study points to a hypothesis where the condition is driven by a cascade of biochemical alterations affecting energy metabolism, neurotransmitter synthesis, and protein biosynthesis. This systems-level insight not only enhances our understanding of the disease mechanism but also opens new avenues for therapeutic intervention by targeting these interconnected metabolic pathways. The identification of novel metabolites within these clusters holds promise for advancing our knowledge of metabolic diseases and developing more precise diagnostic and therapeutic strategies.",5
"hypothalamus","The integrative metabolomics analysis of the case versus control comparison, employing MS2 functional clustering, reveals a complex and interconnected metabolic landscape characterized by significant cross-talk between various functional modules. This systems-level perspective underscores the intricate interplay between energy production, lipid metabolism, and signaling pathways, which collectively shape the overall metabolic phenotype observed in the condition under investigation.

Central to this metabolic network is the role of ubiquinone and terpenoid-quinone biosynthesis, which is intricately linked to cellular energy metabolism through its involvement in the electron transport chain. The inferred presence of NADH-ubiquinone oxidoreductase suggests an active mitochondrial function, supporting ATP synthesis and highlighting a potential compensatory mechanism to meet increased energy demands. This is complemented by the acylcarnitine metabolism module, which facilitates the transport and oxidation of fatty acids, further contributing to energy production. The interplay between these pathways suggests a coordinated effort to optimize energy flux, particularly in tissues with high metabolic rates such as the heart and skeletal muscles.

The integration of lipid metabolism is further exemplified by the cardiolipin biosynthesis and fatty acid metabolism clusters. Cardiolipin's role in maintaining mitochondrial membrane integrity and function is crucial for efficient energy production, while fatty acid metabolism provides essential substrates for ATP generation. The potential involvement of biguanides in modulating glucose and lipid metabolism suggests a feedback loop that could influence overall metabolic homeostasis, particularly in response to altered energy demands or nutrient availability.

The presence of arginine and proline metabolism, alongside N-acylethanolamine and triterpenoid biosynthesis, indicates a broader metabolic adaptation involving amino acid recycling and lipid signaling. These pathways are pivotal for maintaining nitrogen balance, modulating inflammatory responses, and supporting cellular signaling processes. The inferred cross-talk between these modules suggests a dynamic interplay that could influence membrane dynamics, cellular differentiation, and immune function, reflecting a systemic response to the physiological or pathological condition.

Despite the structural uncharacterization of many clustered metabolites, their functional similarity inferred through MS2 clustering provides valuable insights into their likely biological roles. These unknown metabolites may represent novel intermediates or biomarkers, offering potential avenues for further investigation into the underlying mechanisms driving the observed metabolic rewiring. The integration of heme metabolism and the pentose phosphate pathway further highlights the complexity of the metabolic network, with implications for redox balance, oxidative stress response, and nucleotide biosynthesis.

The observed metabolic phenotype suggests a condition characterized by heightened energy demands, possibly linked to increased cellular proliferation or stress responses. The tissue-specific effects, particularly in energy-intensive organs, underscore the importance of metabolic flexibility and adaptation in maintaining homeostasis. The potential organ cross-talk, facilitated by shared metabolic intermediates and signaling molecules, reflects a coordinated systemic response that may be critical for coping with the disease or treatment-induced challenges.

In conclusion, the metabolic rewiring observed in this study points to a condition marked by enhanced energy production, lipid metabolism, and signaling integration, potentially driven by increased cellular proliferation or stress adaptation. This complex interplay of pathways not only highlights the multifaceted nature of the metabolic response but also suggests potential therapeutic targets and biomarkers for further exploration. The identification of novel pathway intermediates among the uncharacterized metabolites offers exciting opportunities for advancing our understanding of the underlying biological mechanisms and their implications for disease management.",12
"ileocecum","The integrative analysis of the metabolomics data reveals a complex metabolic landscape characterized by significant cross-talk between various functional modules, suggesting a coordinated response to the experimental condition or disease state. The absence of structurally identified metabolites within the clusters underscores the potential for novel insights into metabolic pathways, as the functional clustering based on MS2 spectral similarity provides a window into the interconnectedness of these pathways.

Central to this metabolic network is the interplay between nitrogen metabolism and lipid metabolic processes, such as de novo triacylglycerol biosynthesis and glycerophospholipid metabolism. The inferred involvement of nitrogenous compounds in pathways like amino acid biosynthesis and degradation suggests a potential feedback loop with lipid metabolism, where nitrogen assimilation and the urea cycle might influence lipid remodeling and energy storage. This is further supported by the presence of glycerophosphate derivatives and lysophosphatidic acids, indicating active lipid synthesis and signaling processes that are crucial for maintaining cellular energy balance and membrane integrity.

The observed alterations in retinol and retinoid metabolism highlight the potential impact on cellular differentiation and immune function, with implications for tissue-specific effects, particularly in organs such as the liver and kidneys. These organs are pivotal in detoxification and metabolic regulation, suggesting that changes in retinol homeostasis could influence systemic health and disease progression. The presence of steroid hormone biosynthesis pathways further underscores the role of lipid-derived signaling molecules in modulating physiological responses, potentially affecting stress response and metabolic regulation.

The cross-module integration also points to a significant role for oxidative stress management, as evidenced by the superoxide degradation cluster. The inferred involvement of antioxidant defense mechanisms, such as glutathione-related pathways, suggests a compensatory response to mitigate oxidative damage, which may be exacerbated by metabolic dysregulation in the case group. This is complemented by the potential interactions between leukotriene metabolism and inflammatory signaling, highlighting the intricate balance between pro-inflammatory and anti-inflammatory pathways in maintaining cellular homeostasis.

Moreover, the functional modules associated with carnitine metabolism and nicotinate and nicotinamide metabolism suggest a broader metabolic phenotype characterized by altered energy flux and redox states. The inferred disruptions in fatty acid oxidation and NAD+ biosynthesis pathways indicate a potential shift towards alternative energy sources, such as ketogenesis, which may reflect an adaptive response to metabolic stress or nutrient availability.

The structural uncharacterization of many metabolites within these clusters presents an opportunity to explore novel pathway intermediates or biomarkers. The functional similarity inferred through MS2 clustering suggests that these unknowns may play critical roles in the observed metabolic rewiring, potentially representing new targets for therapeutic intervention or diagnostic markers.

In conclusion, the metabolic rewiring observed in this study reflects a complex interplay of pathways involved in energy metabolism, lipid signaling, and oxidative stress response. The integration of these functional modules suggests a coordinated effort to maintain cellular and systemic homeostasis in the face of metabolic challenges. This systemic perspective provides a hypothesis that the underlying mechanism involves a dynamic balance between metabolic adaptation and stress response, which may be pivotal in understanding the pathophysiology of the condition under investigation. The insights gained from this analysis not only enhance our understanding of metabolic networks but also pave the way for future research into the roles of these uncharacterized metabolites in health and disease.",18
"kidney","The integration of metabolomics data from our case versus control study reveals a complex network of metabolic cross-talk, highlighting the intricate interplay between various functional modules that underpin the observed physiological changes. The clustering of metabolites into distinct functional modules, despite the lack of structural characterization for many, provides valuable insights into the metabolic phenotype associated with the condition under investigation.

The lysine degradation pathway, represented by Cluster 8, emerges as a central hub of metabolic activity, interfacing with nitrogen metabolism and peptide modification processes. This cluster's functional connections to the urea cycle and nitrogen balance suggest a compensatory mechanism to manage altered amino acid catabolism, potentially driven by increased energy demands or stress responses. The inferred presence of metabolites related to organic acids and derivatives within this cluster further supports the notion of enhanced metabolic fluxes through the tricarboxylic acid (TCA) cycle, a key energy-producing pathway.

Steroid biosynthesis, as indicated by Cluster 1, is another critical module that appears to be intricately linked with broader lipid metabolism and hormone signaling cascades. The functional evidence suggests that sterol intermediates and glucuronidation pathways are engaged, possibly reflecting a need to modulate hormone levels and maintain cellular homeostasis in response to physiological changes. This interaction with lipid metabolism may also provide feedback to the lysine degradation pathway, as acetyl-CoA, a product of lysine catabolism, serves as a precursor for steroid biosynthesis.

The presence of indole alkaloid biosynthesis (Cluster 6) and benzoate metabolism (Cluster 5) further underscores the complexity of the metabolic landscape. Indole derivatives are known to participate in signaling cascades and regulatory networks, potentially influencing cellular responses to environmental stimuli. Meanwhile, the detoxification role of benzoate metabolism highlights the organism's efforts to manage oxidative stress and inflammatory signaling, processes that are often dysregulated in disease states.

Branched-chain amino acid (BCAA) metabolism, represented by Cluster 4, is crucial for energy production and amino acid turnover. The inferred disruptions in BCAA catabolic pathways suggest metabolic rewiring to accommodate altered energy demands or to support anabolic processes. This module's interaction with biotin metabolism (Cluster 3), which is vital for fatty acid synthesis and gluconeogenesis, points to potential compensatory mechanisms aimed at maintaining energy balance and metabolic flexibility.

The benzenoid metabolism (Cluster 7) and vitamin D metabolism (Cluster 2) clusters highlight the organism's adaptive responses to maintain cellular signaling and systemic physiological regulation. The involvement of oxidative stress responses and neurotransmitter pathways in benzenoid metabolism suggests a role in modulating cellular defense mechanisms, while vitamin D metabolism's interaction with membrane-related activities may influence receptor activation and signaling pathways critical for calcium and phosphate homeostasis.

Collectively, these findings paint a picture of a dynamic metabolic phenotype characterized by enhanced energy production, stress response modulation, and hormone regulation. The tissue-specific effects and organ cross-talk likely reflect an organism-wide effort to adapt to the condition, with potential implications for understanding the disease's metabolic underpinnings. The structurally uncharacterized metabolites, identified through functional clustering, may represent novel intermediates or biomarkers, offering new avenues for research and therapeutic intervention.

In conclusion, the metabolic rewiring observed in this study suggests a hypothesis that the condition induces a state of metabolic adaptation, characterized by enhanced catabolic and anabolic activities to meet altered physiological demands. This integrative systems-level analysis not only provides insights into the underlying mechanisms of the condition but also highlights the potential for discovering novel metabolic pathways and therapeutic targets.",8
"liver","The integration of metabolomic data from the case versus control comparison, utilizing MS2 functional clustering, reveals a complex interplay between bile acid biosynthesis and terpene glycoside metabolism. These two functional modules, although initially appearing distinct, may be interconnected through shared metabolic pathways and compensatory mechanisms that reflect the underlying physiological state of the condition under investigation.

Bile acid biosynthesis, predominantly occurring in the liver, is a cornerstone of lipid metabolism, crucial for cholesterol homeostasis and the emulsification of dietary fats. The presence of metabolites linked to this pathway, despite being structurally uncharacterized, suggests an active lipid metabolic network. This network is likely modulated by the endoplasmic reticulum and peroxisomes, which are known sites for lipid processing and detoxification. The involvement of intermediates associated with metabolic disorders like 27-Hydroxylase Deficiency highlights the potential for dysregulation in bile acid synthesis to contribute to disease phenotypes. In parallel, terpene glycoside metabolism, typically associated with plant defense and secondary metabolism, emerges as a significant player in modulating cellular signaling and membrane dynamics. The inferred presence of terpene glycosides and their interaction with lipid metabolism suggests a broader metabolic adaptation that could influence cellular energy balance and stress responses.

The metabolic phenotype observed in the case group may reflect a compensatory response to disrupted cholesterol and lipid homeostasis. The cross-talk between bile acid and terpene glycoside pathways could involve feedback loops where the synthesis and breakdown of these compounds are finely regulated to maintain cellular equilibrium. For instance, the modulation of terpene glycoside metabolism might serve as a compensatory mechanism to buffer against the dysregulation of bile acid pathways, potentially through alterations in membrane composition and signaling pathways that impact cellular energy flux and communication.

In a physiological context, these metabolic changes likely manifest as tissue-specific effects, with the liver playing a central role in orchestrating these processes. The liver's capacity to regulate bile acid synthesis and respond to metabolic stress could influence systemic lipid metabolism, with potential ramifications for other organs, such as the intestines, where bile acids facilitate nutrient absorption. This organ cross-talk underscores the complexity of the metabolic networks at play and highlights the potential for systemic metabolic dysregulation in the condition under study.

The structural uncharacterization of many metabolites within these clusters presents both a challenge and an opportunity. The functional similarity revealed through MS2 clustering suggests that these unknowns may represent novel intermediates or biomarkers, offering new insights into the metabolic pathways involved. These metabolites could hold the key to understanding the full scope of metabolic rewiring occurring in the case group, pointing to previously unrecognized pathways or regulatory mechanisms.

In conclusion, the observed metabolic rewiring suggests a hypothesis where the interplay between bile acid biosynthesis and terpene glycoside metabolism reflects an adaptive response to maintain metabolic homeostasis under pathological conditions. This adaptation may involve novel signaling cascades and feedback loops that modulate lipid and energy metabolism. The identification of these pathways and their regulatory mechanisms could provide valuable insights into the condition's etiology and progression, potentially unveiling new therapeutic targets or biomarkers for diagnosis and treatment. As we embrace the unknowns within these clusters, we open the door to a deeper understanding of the metabolic landscape and its implications for health and disease.",2
"lung","The integration of metabolomic data from case versus control comparisons reveals intricate metabolic cross-talk between fluoride and glutamate metabolism, suggesting a complex interplay that may underpin the observed physiological phenotype. While the specific identities of the metabolites remain elusive, the functional clustering via MS2 analysis provides compelling evidence of their biological roles, pointing to a systemic metabolic adaptation in response to environmental or pathological stressors.

The juxtaposition of fluoride and glutamate metabolism highlights potential compensatory mechanisms that maintain cellular homeostasis. Fluoride metabolism, characterized by the detoxification and systemic management of fluoride ions, intersects with glutamate metabolism through shared oxidative stress and detoxification pathways. The presence of fluoride in body fluids necessitates efficient detoxification processes, possibly involving oxidative stress responses that are also pertinent to glutamate metabolism. The inferred involvement of carboxymethylenebutenolidase homolog in fluoride processing suggests enzymatic activities that might also intersect with glutamate pathways, particularly in managing reactive oxygen species, a common byproduct of both fluoride exposure and glutamate metabolism.

The physiological context of these metabolic interactions suggests a broader metabolic phenotype characterized by enhanced detoxification and stress response capabilities. The tissue-specific effects likely involve organs such as the kidneys and liver, which are central to detoxification and metabolic regulation. The potential cross-talk between these organs could facilitate the redistribution and excretion of fluoride, while simultaneously modulating glutamate metabolism to support neurotransmitter balance and nitrogen metabolism. This organ cross-talk may be critical in maintaining systemic balance, especially under conditions that disrupt normal metabolic functions, such as exposure to environmental toxins or disease states.

The uncharacterized metabolites within these clusters, although structurally unknown, likely represent novel intermediates or biomarkers that reflect underlying metabolic rewiring. Their functional similarity, as revealed by MS2 clustering, suggests roles in detoxification and stress adaptation, potentially unveiling new pathways or regulatory mechanisms. These unknowns may hold the key to understanding the compensatory adjustments that occur in response to metabolic perturbations, offering insights into novel therapeutic targets or diagnostic markers.

From a biological perspective, the observed metabolic rewiring suggests an adaptive mechanism that enhances the organism's ability to cope with environmental or pathological challenges. The interplay between fluoride and glutamate metabolism may reflect a coordinated response to maintain cellular and systemic homeostasis, balancing detoxification with energy and neurotransmitter metabolism. This coordination could be particularly relevant in conditions characterized by altered mineral metabolism or neurodegeneration, where the ability to manage oxidative stress and maintain metabolic flexibility is crucial.

In conclusion, the integration of fluoride and glutamate metabolism in this study underscores the complexity of metabolic networks and their role in disease and adaptation. The functional clustering of unknown metabolites suggests a sophisticated system of metabolic regulation that responds to environmental and physiological challenges. This metabolic rewiring not only provides insights into the underlying mechanisms of the condition studied but also highlights the potential for discovering novel metabolic pathways and biomarkers that could inform future research and therapeutic strategies.",2
