"tissue","cluster_id","functional_name","report","feature_count","pmids"
"duodenum",8,"Glutathione metabolism","Glutathione metabolism plays a crucial role in maintaining cellular redox balance, detoxification, and protecting cells from oxidative stress. At the cellular level, glutathione acts as a major antioxidant, directly scavenging reactive oxygen species and serving as a substrate for glutathione peroxidase in the reduction of hydrogen peroxide. Although no structurally identified metabolites anchor this cluster, the inferred functional evidence suggests processes related to glutathione metabolism. For instance, the presence of epsilon-(gamma-Glutamyl)-L-lysine and 5-L-Glutamyl-taurine indicates potential involvement in gamma-glutamyl cycle activities, which are integral to amino acid transport and metabolism. Cysteinyl-Glutamine, a dipeptide, hints at the interconnectedness of glutathione metabolism with peptide synthesis and degradation pathways. The role of Glutamylcysteine, detectable in biofluids like saliva, further supports the involvement of glutathione in systemic antioxidant defense and detoxification processes. Additionally, N5-Acetyl-N2-gamma-L-glutamyl-L-ornithine's association with cytoplasmic and extracellular spaces suggests a broader role in cellular signaling and metabolic regulation. These functionally related but structurally uncharacterized metabolites collectively highlight the complexity of glutathione metabolism, emphasizing its integration with amino acid metabolism and its critical role in cellular homeostasis and defense mechanisms.",9,"29915025,27048822,32649885"
"duodenum",9,"Fatty acid metabolism","Fatty acid metabolism plays a crucial role in cellular energy homeostasis, membrane synthesis, and signaling processes. At the cellular level, this metabolic pathway encompasses the breakdown and synthesis of fatty acids, which are essential for generating ATP through β-oxidation in mitochondria and for synthesizing complex lipids for cellular membranes. Although no known metabolites anchor Cluster 9, the inferred evidence suggests involvement in fatty acid metabolism, particularly through compounds like (9Z)-Icos-9-enoylcarnitine and Icosa-8,11,14-trienoylcarnitine, which are associated with lipid transport and fatty acid esterification. These functionally related but structurally uncharacterized metabolites may participate in transporting long-chain fatty acids into mitochondria for oxidation, a critical step in energy production. Additionally, the presence of lipid-like molecules suggests potential roles in membrane remodeling and signaling cascades, such as those involving lipid mediators in inflammatory responses. The inferred presence of neocarthamin and pterocarpan derivatives, although less directly linked to fatty acid metabolism, may indicate interactions with other metabolic pathways, such as those involved in xenobiotic metabolism or antioxidant responses. Overall, the cluster suggests a complex interplay between energy metabolism, membrane dynamics, and possibly detoxification processes, highlighting the multifaceted nature of fatty acid metabolism in cellular physiology.",8,"23791484,26499846,31819192"
"duodenum",10,"Glycerophospholipid metabolism (neuronal signaling)","Glycerophospholipid metabolism is a critical cellular process involved in the synthesis and remodeling of membrane lipids, which are essential for maintaining cell structure, signaling, and energy storage. This metabolic pathway encompasses the transformation of glycerophospholipids, which are key components of the lipid bilayer, influencing membrane fluidity and permeability. Although no known metabolites have been identified in Cluster 10, the inferred functional evidence suggests the involvement of several enzymatic activities and metabolic pathways. For instance, the association of an unknown metabolite with diacylglycerol kinase gamma implies a role in the conversion of diacylglycerol to phosphatidic acid, a precursor for the biosynthesis of other glycerophospholipids and a signaling lipid involved in cellular processes such as proliferation and survival. Additionally, the involvement of phospholipase D2 suggests participation in the hydrolysis of phosphatidylcholine to produce phosphatidic acid, further linking to signal transduction pathways. The presence of functionally related but structurally uncharacterized metabolites within the prostaglandin subclass indicates potential interactions with inflammatory signaling pathways, possibly mediating responses to cellular stress or injury. Overall, the cluster appears to be intricately connected to membrane dynamics, signal transduction, and possibly inflammatory responses, highlighting the complex interplay of glycerophospholipid metabolism in cellular homeostasis and adaptation.",12,"35108060,37992400,36131016"
"duodenum",11,"Carotenoid metabolism","Carotenoid metabolism is a critical biological process involved in the synthesis, degradation, and conversion of carotenoids, which are essential lipophilic compounds found in various tissues. These compounds play vital roles in membrane structure, photoprotection, and as precursors for signaling molecules. Although no known metabolites anchor this cluster, the inferred evidence suggests the presence of functionally related but structurally uncharacterized metabolites that may participate in similar pathways. Carotenoids such as y,y-Carotene, classified under lipids, are integral to membrane remodeling and cellular signaling due to their antioxidant properties and ability to modulate membrane fluidity. The presence of carbonyl compounds like 9,9'-Diapo-10,9'-retro-carotene-9,9'-dione indicates potential involvement in oxidative processes and cellular stress responses. Additionally, the detection of prenol lipids such as Methyl (7Z,9Z,9'Z)-6'-apo-y-caroten-6'-oate suggests a role in the biosynthesis of bioactive molecules that could influence energy flux and metabolic signaling. The biospecimen analysis revealing E,e-Carotene-3,3'-dione in blood and breast milk highlights the systemic distribution and potential nutritional or signaling roles of these metabolites. Collectively, these findings suggest that the cluster may be involved in pathways related to oxidative stress response, membrane integrity, and signaling cascades crucial for maintaining cellular homeostasis and responding to environmental changes.",10,"36994862,25578273,31794861"
"facial_skin",1,"Phosphatidylcholine biosynthesis","Phosphatidylcholine biosynthesis is a critical cellular process involved in the formation of phosphatidylcholine, a major component of cell membranes that plays a pivotal role in membrane structure and function. This process is essential for maintaining membrane integrity, fluidity, and the formation of lipid bilayers, which are crucial for cell signaling, membrane trafficking, and lipid metabolism. Although no known metabolites were identified in Cluster 1, the inferred functional evidence suggests the involvement of phosphatidylcholine biosynthesis, highlighted by the presence of PE-NMe2(18:0/22:4(7Z,10Z,13Z,16Z)), which is directly associated with this biosynthetic pathway. This implies that the cluster might be related to alterations in membrane composition or dynamics, potentially influencing cellular processes such as signal transduction and vesicular transport. Additionally, the presence of functionally related but structurally uncharacterized metabolites, such as those classified under organic compounds and fatty acyls, suggests a broader involvement in lipid metabolism and possibly in the regulation of inflammatory signaling pathways. These metabolites may participate in the remodeling of membrane lipids, impacting cellular responses to environmental changes or stress conditions. Overall, the cluster indicates a functional module potentially engaged in membrane remodeling and lipid-mediated signaling, essential for cellular homeostasis and adaptation.",4,"38194288,30379616,6145585"
"facial_skin",2,"Cephalosporin biosynthesis","Cephalosporin biosynthesis is a critical process in the production of cephalosporin antibiotics, which are vital for inhibiting bacterial cell wall synthesis. At the cellular level, this process involves the transformation of precursors into active antibiotic compounds, primarily through enzymatic reactions that modify the beta-lactam structure essential for antibacterial activity. Although no structurally identified metabolites anchor this cluster, the inferred presence of 7-Aminocephalosporanic acid suggests a foundational role in the biosynthesis pathway, as it is a key intermediate in the production of cephalosporins. The involvement of acetyltransferase CD1211 in its metabolism indicates potential acetylation reactions crucial for modifying cephalosporin precursors. Functionally related but structurally uncharacterized metabolites, such as those resembling Daglutril and Glutathionylcobalamin, may imply additional biochemical pathways intersecting with cephalosporin biosynthesis, possibly influencing redox states or peptide modification. The presence of N-octanoylglutamine and Lysylglutamine in blood and urine suggests their roles in broader metabolic networks, potentially linked to amino acid metabolism and organic acid pathways, which may support the energy and structural demands of antibiotic synthesis. These interconnected pathways highlight a complex network of enzymatic activities and metabolic fluxes essential for the efficient production of cephalosporins, underscoring the intricate balance of cellular processes required for antimicrobial efficacy.",7,"35287674,39525575,35636175"
"fallopian_tube",1,"Nicotinate and nicotinamide metabolism","Nicotinate and nicotinamide metabolism is crucial for cellular energy homeostasis and redox balance, primarily through the synthesis and recycling of nicotinamide adenine dinucleotide (NAD+), a pivotal coenzyme in redox reactions and a substrate for various enzymatic processes, including sirtuins and poly(ADP-ribose) polymerases. This metabolic pathway contributes to cellular processes such as DNA repair, gene expression regulation, and metabolic signaling. Despite the absence of structurally identified metabolites in this cluster, the inferred presence of compounds such as biguanides, which are known to influence glucose metabolism and mitochondrial function, suggests potential alterations in energy metabolism and insulin signaling pathways. Additionally, the presence of fluoride, a compound found in body fluids, could imply interactions with mineral metabolism or oxidative stress responses. Functionally related but structurally uncharacterized metabolites, such as those resembling gamma butyrolactones and hydropyridines, may participate in modulating cellular signaling and receptor interactions, potentially affecting processes like neurotransmission or vascular regulation. Together, these inferred metabolites, while not confirmed, suggest a complex interplay within the nicotinate and nicotinamide metabolic pathways that may impact cellular energy dynamics and stress responses, highlighting the need for further structural elucidation to fully understand their roles in the context of the experimental conditions.",12,"38897198,37012289,32822582"
"fallopian_tube",2,"Bile acid biosynthesis","Bile acid biosynthesis is a critical metabolic process occurring primarily in the liver, where cholesterol is converted into bile acids. These bile acids play essential roles in the digestion and absorption of dietary fats and fat-soluble vitamins in the intestine. They also function as signaling molecules that regulate lipid metabolism and glucose homeostasis. Despite the absence of structurally identified metabolites in Cluster 2, the inferred evidence suggests the involvement of cholesterols and their derivatives, which are integral to bile acid biosynthesis. Compounds such as 5beta-Cholestane-3alpha,7alpha,24-triol and (3alpha,4alpha,5alpha)-4-(2-Propenyl)cholestan-3-ol indicate the presence of intermediates in the cholesterol catabolic pathway leading to bile acid formation. Cholestenone, detectable in blood, feces, and urine, signifies its role in systemic cholesterol metabolism and its potential conversion into bile acids. Furthermore, 5-alpha-Cholestane-3-beta,5,6-beta-triol, 6-acetate 3-(hydrogen succinate) suggests lipid remodeling activities, consistent with the transformation of cholesterol into bile acids. These functionally related but structurally uncharacterized metabolites likely participate in pathways such as the classical and alternative bile acid synthesis pathways, impacting cholesterol homeostasis and enterohepatic circulation. This cluster highlights the intricate network of lipid metabolism and its broader implications in maintaining metabolic balance and nutrient absorption.",8,"38653239,29080336,31984784"
"fallopian_tube",3,"Trandolapril metabolism","Trandolapril metabolism involves the conversion of the prodrug Trandolapril into its active form, Trandolaprilat, primarily in the liver. This process is crucial for its role as an angiotensin-converting enzyme (ACE) inhibitor, which helps regulate blood pressure by preventing the conversion of angiotensin I to angiotensin II, a potent vasoconstrictor. Although no structurally identified metabolites anchor this cluster, the inferred presence of Trandolapril and Trandolaprilat suggests significant involvement in the Trandolapril Action and Metabolism Pathways. These pathways are integral to cardiovascular homeostasis, as they modulate vascular tone and fluid balance. The functional descriptions of uncharacterized metabolites, such as those related to organic acids and derivatives, hint at potential interactions with amino acids, peptides, and analogues, reflecting the dipeptide nature of Trandolapril. This aligns with the drug's mechanism of action, where peptide bonds play a critical role in its enzymatic conversion. The presence of functionally related but structurally uncharacterized metabolites may indicate additional metabolic transformations or interactions that could influence the drug's efficacy and pharmacokinetics. Overall, the cluster suggests a complex network of metabolic processes underpinning Trandolapril's therapeutic effects, emphasizing the importance of understanding these pathways for optimizing treatment outcomes in hypertension and related cardiovascular conditions.",7,"38771738,33574248"
"fallopian_tube",4,"Glutathione metabolism","Glutathione metabolism is a critical cellular process primarily involved in maintaining redox homeostasis and detoxifying reactive oxygen species (ROS) and xenobiotics. At the cellular level, glutathione acts as a major antioxidant, safeguarding cellular components from oxidative damage by neutralizing free radicals and peroxides. Although no known metabolites were directly identified in this cluster, the inferred functional evidence suggests involvement in pathways where glutathione plays a pivotal role, such as the Magnesium salicylate, Mefenamic Acid, and Meloxicam action pathways. These pathways are indicative of glutathione's role in drug metabolism and its interaction with various pharmaceutical agents, potentially modulating their efficacy and toxicity. The presence of 4-Hydroxynonenal glutathione in biospecimens like blood and urine further supports the involvement of glutathione in detoxification processes, as this conjugate is a known product of lipid peroxidation, highlighting its role in mitigating oxidative stress. The functionally related but structurally uncharacterized metabolites in this cluster may participate in similar detoxification and antioxidant processes, contributing to the maintenance of cellular integrity and function. Overall, glutathione metabolism is intricately linked to pathways that manage oxidative stress and detoxification, underscoring its importance in cellular defense mechanisms and metabolic regulation.",14,"29915025,27048822,32649885"
"fallopian_tube",5,"Purine metabolism","Purine metabolism is a critical cellular process involved in the synthesis, breakdown, and recycling of purine nucleotides, which are essential components of DNA, RNA, and energy carriers like ATP and GTP. Although Cluster 5 lacks structurally identified metabolites, the inferred presence of 2'-Deoxyinosine triphosphate and Deoxyinosine suggests a focus on the nucleotide synthesis and salvage pathways within purine metabolism. These pathways are vital for maintaining nucleotide pools necessary for DNA replication and repair, particularly in rapidly dividing cells or tissues under stress. The MS2 spectral similarity indicates that the unknown metabolites in this cluster are functionally related to these processes, potentially participating in the regulation of nucleotide availability or the detoxification of nucleotide degradation products. The involvement of purine 2'-deoxyribonucleosides and triphosphates highlights the importance of this cluster in DNA synthesis and repair pathways. In the context of a treatment or disease state, alterations in purine metabolism could reflect shifts in cellular proliferation rates, energy demands, or responses to oxidative stress. This cluster may also intersect with signaling cascades that utilize purine derivatives, such as cyclic AMP, thereby influencing broader cellular functions like gene expression and metabolic regulation. The functionally related but structurally uncharacterized metabolites likely play supportive roles in these pathways, contributing to the dynamic balance of purine metabolism under varying physiological conditions.",6,"38823389,34767747,35964092"
"fallopian_tube",6,"Glycerophospholipid metabolism","Glycerophospholipid metabolism is a crucial cellular process involved in the synthesis, remodeling, and degradation of glycerophospholipids, which are fundamental components of cell membranes and play significant roles in signaling pathways. Although there are no structurally identified metabolites in Cluster 6, the inferred functional evidence suggests that this cluster is actively involved in phospholipid signaling and membrane dynamics. Phospholipase D2 and diacylglycerol kinase alpha, enzymes associated with the metabolism of phosphatidic acid (PA) derivatives, are implicated in the functional context of this cluster. These enzymes are pivotal in the conversion of PA to diacylglycerol (DAG) and subsequently to phosphatidic acid, which are key intermediates in lipid signaling and membrane trafficking. The involvement of glycerophosphoglycerophosphates and fatty acyls suggests an intricate network of lipid-like molecules contributing to membrane fluidity and cellular signaling. The presence of functionally related but structurally uncharacterized metabolites indicates potential roles in pathways such as inflammatory signaling and energy flux, given the involvement of lipid mediators like prostaglandins and thromboxanes. This cluster may reflect alterations in membrane composition and signaling cascades, which are critical in the context of disease or treatment, influencing cellular responses and homeostasis.",10,"35108060,37992400,36131016"
"fallopian_tube",7,"Dopamine beta-hydroxylase deficiency pathway","The Dopamine beta-hydroxylase deficiency pathway is primarily involved in the biosynthesis of norepinephrine from dopamine, a critical process for neurotransmitter regulation in the central and peripheral nervous systems. In the absence of structurally identified metabolites within Cluster 7, our understanding is supported by functionally related but structurally uncharacterized metabolites. Topaquinone's involvement in the Dopamine beta-hydroxylase deficiency pathway suggests its role as a cofactor in the enzymatic conversion of dopamine to norepinephrine, highlighting disruptions in catecholamine synthesis. This deficiency can lead to impaired sympathetic nervous system function, manifesting in symptoms such as orthostatic hypotension and other autonomic dysfunctions. Additionally, the presence of metabolites like Capravirine, classified under organosulfur compounds, may indicate alterations in sulfur metabolism, which could influence redox states and cellular signaling pathways. The tissue distribution of RPR123142 in the kidney and liver suggests potential systemic effects, possibly affecting detoxification processes and metabolic homeostasis. Furthermore, the presence of AB-Fubinaca in blood samples might imply interactions with cannabinoid receptor pathways, potentially modulating neurological and immune responses. Collectively, these functionally related metabolites underscore a complex interplay of metabolic and signaling pathways that are crucial for maintaining neurotransmitter balance and systemic physiological functions.",11,"16722595,15240410"
"fallopian_tube",8,"Biotin metabolism","Biotin metabolism is a critical biological process involved in the regulation of carboxylase enzymes, which are essential for various cellular functions, including fatty acid synthesis, amino acid catabolism, and gluconeogenesis. Although no structurally identified metabolites are available in Cluster 8, inferred evidence suggests the involvement of biotin derivatives such as biotin sulfone and biotin hydrazide. These compounds indicate the presence of biotin-related metabolic activities, potentially involving biotin recycling and degradation pathways. Biotin sulfone, for instance, is a known urinary excretion product, suggesting enhanced biotin turnover or altered biotin utilization in the case group compared to controls. The presence of functionally related but structurally uncharacterized metabolites in this cluster implies potential disruptions or adaptations in biotin-dependent processes, possibly affecting energy metabolism and cellular growth. Additionally, the mention of L-arginino-succinate, although not directly linked to biotin metabolism, hints at interconnected pathways involving amino acid metabolism, which may be influenced by the availability of biotin as a cofactor. Overall, the cluster likely represents a dynamic module involved in maintaining metabolic homeostasis through biotin-mediated enzymatic reactions, highlighting the importance of biotin in cellular energy management and metabolic flexibility.",19,"38928282,19319844"
"femoral_vein",1,"Steroid hormone biosynthesis","Steroid hormone biosynthesis is a critical biological process that occurs primarily in the adrenal glands, gonads, and placenta, where it plays a pivotal role in producing steroid hormones such as glucocorticoids, mineralocorticoids, and sex steroids. These hormones are essential for regulating a variety of physiological functions, including metabolism, immune response, electrolyte balance, and reproductive processes. Despite the absence of structurally identified metabolites in this cluster, the inferred functional evidence suggests the presence of compounds structurally related to steroid precursors and intermediates. The presence of organic compounds with cyclopenta[a]phenanthrene cores, such as those inferred in this cluster, is indicative of steroidal structures, which are central to this biosynthetic pathway. Additionally, the detection of these functionally related but structurally uncharacterized metabolites in blood samples suggests active steroidogenesis and potential alterations in steroid hormone levels in the case group compared to controls. This could imply changes in pathways such as the hypothalamic-pituitary-adrenal (HPA) axis or sex steroid signaling cascades, which are crucial for maintaining homeostasis. The involvement of these pathways highlights the potential impact of the unknown metabolites on processes like membrane remodeling and inflammatory signaling, as steroid hormones are known to modulate these cellular functions. Therefore, further characterization of these metabolites could provide deeper insights into the alterations in steroid hormone biosynthesis under the experimental conditions.",4,"31362062,37277481,25465475"
"femoral_vein",2,"Acylaminosugar metabolism","Acylaminosugar metabolism is a critical cellular process involved in the modification and utilization of sugar moieties that contain acylamino groups. These modified sugars play essential roles in various biological functions, including cell wall integrity, signaling, and immune response modulation. Although no structurally identified metabolites anchor this cluster, the inferred presence of compounds such as LPS with O-antigen suggests involvement in bacterial cell wall biosynthesis and immune system interactions. LPS (lipopolysaccharide) is a major component of the outer membrane of Gram-negative bacteria and plays a pivotal role in triggering host immune responses. The presence of functionally related but structurally uncharacterized metabolites, such as those resembling 1-Deoxy-1-morpholino-D-fructose and Cyclocalopin C1, indicates potential roles in carbohydrate metabolism and signaling pathways. These compounds might participate in pathways that modify sugar structures, influencing membrane remodeling and cellular communication. Additionally, the involvement of metabolites like Phosphocysteamine and Cavidine, albeit inferred, suggests potential intersections with organothiophosphorus metabolism and secondary metabolite pathways, respectively. Overall, the acylaminosugar metabolic process appears to be intricately linked to cellular defense mechanisms, structural maintenance, and possibly the modulation of metabolic fluxes in response to external stimuli, especially in the context of disease or treatment conditions.",7,"18538731,33601415,36858045"
