"tissue","cluster_id","functional_name","report","feature_count","pmids"
"ovary",4,"Biotin metabolism","Biotin metabolism plays a crucial role in cellular and tissue-level processes, primarily through its involvement in carboxylation reactions necessary for fatty acid synthesis, amino acid metabolism, and gluconeogenesis. Biotin acts as a coenzyme for carboxylases, facilitating the transfer of carbon dioxide in metabolic reactions. Although no known metabolites are identified in this cluster, the inferred presence of biotin derivatives such as biotin sulfone, FP-biotin, and biotin sulfoxide suggests active biotin-related processes. These derivatives are typically associated with blood, indicating systemic involvement and potential alterations in biotin metabolism in the case group compared to controls. The presence of these compounds implies that the metabolic pathways involving biotin, such as the acetyl-CoA carboxylase and pyruvate carboxylase pathways, may be functionally active or altered. These pathways are integral to lipid biosynthesis and energy production, suggesting that the unidentified metabolites in this cluster may be functionally related to these processes. The structural uncharacterization of these metabolites does not diminish their potential role in modulating biotin-dependent pathways, possibly affecting cellular energy homeostasis and lipid metabolism. This functional module underscores the importance of biotin metabolism in maintaining metabolic balance, with potential implications for understanding the metabolic shifts observed in the treatment or disease context.",30,"38928282,19319844"
"ovary",5,"Furan metabolism","Furan metabolism at the cellular and tissue level involves the transformation and detoxification of furan compounds, which are typically derived from environmental sources or dietary intake. Although this cluster lacks structurally identified metabolites, the inferred evidence suggests a functional involvement of organic compounds such as hydropyridines and furfuryl derivatives. These compounds are often implicated in cellular processes like detoxification and metabolic conversion, potentially involving pathways related to the metabolism of xenobiotics. The presence of functionally related but structurally uncharacterized metabolites such as 2-(2-Furanyl)-3,4,5,6-tetrahydropyridine and 1-Furfurylpyrrolidine suggests a role in modulating cellular responses to external chemical stimuli. These metabolites might participate in pathways that involve the cytochrome P450 enzyme system, known for its role in the oxidative metabolism of organic substances. Additionally, the involvement of organic acids and derivatives, as indicated by the presence of pyran-3,4-dicarboxylic anhydride-related compounds, points to potential interactions with energy metabolism pathways, possibly influencing the tricarboxylic acid (TCA) cycle. This cluster's activity could be crucial in maintaining cellular homeostasis and protecting tissues from the toxic effects of furan derivatives, highlighting its significance in metabolic and detoxification processes.",12,"39361748,29051014,26889659"
"ovary",6,"Amino acid metabolism (neurotransmitter)","Amino acid metabolism is a fundamental cellular process responsible for the synthesis and degradation of amino acids, which are crucial for protein synthesis, energy production, and the generation of key metabolic intermediates. In the absence of identified metabolites within Cluster 6, the interpretation relies on inferred functional evidence suggesting involvement in amino acid-related pathways. The mention of compounds such as 3-Anilinoalanine, a derivative of alpha amino acids, and Carglumic acid, associated with glutamic acid derivatives, indicates potential activity within pathways like the urea cycle and glutamate metabolism. These pathways are essential for nitrogen balance and neurotransmitter regulation, respectively. The presence of Threonylserine, categorized under organic acids, suggests a role in serine and threonine metabolism, which are pivotal for cellular signaling and structural integrity. Additionally, the inclusion of N-Acetylsphinganine, a ceramide, hints at interactions with sphingolipid metabolism, which is integral to membrane structure and signaling. Together, these functionally related but structurally uncharacterized metabolites imply a complex interplay of amino acid synthesis, degradation, and modification processes, potentially influencing energy flux and cellular signaling pathways. This cluster may reflect alterations in metabolic pathways that are crucial for maintaining cellular homeostasis and responding to physiological changes in the case versus control comparisons.",15,"26499846,37699892,32049045"
"ovary",7,"Carbamazepine metabolism","Carbamazepine metabolism involves the biotransformation of the anticonvulsant drug carbamazepine within the liver, primarily through cytochrome P450 enzymes, to produce pharmacologically active and inactive metabolites. Although no known metabolites anchor Cluster 7, the inferred functional evidence suggests involvement in broader metabolic processes. The presence of oxygen functions in the carbamazepine metabolism pathway indicates oxidative transformations, which are critical for drug detoxification and clearance. Functionally related but structurally uncharacterized metabolites in this cluster, such as those associated with morphinans and alkaloids, hint at complex interactions with neurotransmitter systems or potential modulation of signaling cascades. The mention of 6-Methoxymellein's association with enteral systems and its presence in the cytoplasm and extracellular space suggests potential roles in cellular signaling or transport processes. Additionally, the connection to carnitine synthesis and carnosinuria pathways implies possible interactions with energy metabolism and amino acid processing. These processes collectively underscore the intricate network of metabolic reactions that facilitate carbamazepine's therapeutic effects and its eventual elimination from the body. Understanding these pathways is crucial for optimizing therapeutic outcomes and minimizing adverse effects associated with carbamazepine therapy.",11,"31650507,26327193"
"ovary",8,"Glycerophospholipid metabolism","Glycerophospholipid metabolism plays a crucial role in cellular and tissue-level processes, primarily involving the synthesis, remodeling, and degradation of glycerophospholipids, which are key components of cellular membranes. This metabolic pathway is integral to maintaining membrane fluidity and integrity, facilitating membrane-associated signaling, and supporting the dynamic nature of cellular membranes during processes such as cell division, apoptosis, and vesicular trafficking. Although no known metabolites anchor this cluster, the inferred evidence suggests the involvement of glycerophosphoethanolamines, specifically dimethylphosphatidylethanolamines, which are a subclass of glycerophospholipids. These compounds are implicated in membrane remodeling and the modulation of membrane-bound enzyme activities, potentially affecting cellular signaling pathways. The presence of functionally related but structurally uncharacterized metabolites, inferred to be dimethylphosphatidylethanolamines, suggests a role in the regulation of lipid-mediated signaling cascades, such as those involving phospholipase D and protein kinase C, which are vital for signal transduction and cellular responses to external stimuli. This cluster's association with glycerophospholipid metabolism may also indicate alterations in energy flux and inflammatory signaling, as these pathways are often interconnected with lipid metabolism. The integration of these inferred metabolites into the broader context of glycerophospholipid metabolism highlights their potential impact on cellular function and the physiological adaptations observed in case versus control groups.",10,"35108060,37992400,36131016"
"ovary",9,"Amino acid metabolism (nitrogen metabolism)","Amino acid metabolism is a fundamental biological process involved in the synthesis and degradation of amino acids, serving as building blocks for proteins and as precursors for various bioactive molecules. This process plays a critical role in cellular functions such as protein synthesis, energy production, and the regulation of nitrogen balance. Although Cluster 9 lacks structurally identified metabolites, the inferred functional evidence suggests involvement in pathways related to amino acid metabolism. The presence of Glycyl-Phenylalanine, detected in multiple biospecimens, hints at peptide metabolism and transport processes. Additionally, the classification of one unknown metabolite as an Aminobenzoic acid, akin to Lobenzarit, suggests potential interactions with folate metabolism, which is crucial for nucleotide biosynthesis and amino acid interconversion. The association of another unknown with Trifluoroacetic acid, linked to NADH-ubiquinone oxidoreductase chain 1, indicates possible interactions with mitochondrial energy metabolism and oxidative phosphorylation. These functionally related but structurally uncharacterized metabolites may participate in pathways such as the urea cycle, transamination reactions, or the synthesis of neurotransmitters and other signaling molecules. Overall, the cluster's metabolic signature underscores the dynamic interplay between amino acid metabolism and broader cellular processes, including energy flux and biosynthetic pathways, which may be modulated under different physiological or pathological conditions.",16,""
"ovary",10,"Purine metabolism","Purine metabolism is a crucial cellular process responsible for the synthesis and breakdown of purine nucleotides, which are essential for a variety of biological functions, including DNA and RNA synthesis, energy transfer, and signaling. Although there are no structurally identified metabolites in Cluster 10, the inferred presence of compounds such as 2-Fluoroadenine and 2'-Fluoro-2',3'-dideoxyinosine suggests a functional involvement in purine metabolism. These compounds are related to 6-aminopurines and purine nucleosides, respectively, indicating potential disruptions or modifications in nucleotide synthesis or degradation pathways. The presence of these functionally related but structurally uncharacterized metabolites may imply alterations in nucleotide availability or imbalances in nucleotide pools, which can affect cellular replication and repair processes. Additionally, compounds like 5-DFCR and 1-beta-D-Arabinofuranosyl-5-fluorocytosine, found in blood, are associated with nucleoside analogs that can interfere with nucleic acid metabolism, potentially indicating a therapeutic or stress response. These metabolites may reflect an adaptive response to treatment or disease conditions, affecting pathways such as DNA repair, apoptosis, or cell cycle regulation. Overall, the cluster suggests a significant perturbation in purine metabolism, with potential implications for cellular proliferation and survival pathways.",10,"38823389,34767747,35964092"
"pancreas",1,"Glycerophospholipid metabolism","Glycerophospholipid metabolism is a critical cellular process involved in the synthesis, remodeling, and degradation of glycerophospholipids, which are essential components of cell membranes. This metabolism plays a pivotal role in maintaining membrane integrity, facilitating membrane fluidity, and serving as a reservoir for bioactive lipid mediators. Although no known metabolites anchor this cluster, the inferred evidence suggests involvement in pathways related to inflammatory signaling and membrane dynamics. The presence of compounds like CDP-DG and PA, which are associated with prostaglandins and pyrophosphates, indicates a link to arachidonic acid metabolism and the biosynthesis of signaling molecules such as prostaglandins. Phospholipase A2 activity, as inferred from the metabolism of PE(P-18:0/PGD2), further supports the role of glycerophospholipid metabolism in generating lipid mediators that participate in inflammatory responses and calcium signaling pathways. The functionally related but structurally uncharacterized metabolites in this cluster may contribute to membrane remodeling and energy flux, critical for cellular responses to environmental changes or stress conditions. Overall, this cluster likely represents a functional module where glycerophospholipid metabolism intersects with signaling cascades that regulate inflammation and cellular homeostasis.",13,"35108060,37992400,36131016"
"pancreas",2,"Indole-3-acetate metabolism","Indole-3-acetate metabolism is a crucial biological process primarily involved in the regulation of plant growth and development, but it also plays significant roles in animal systems, particularly in gut microbiota interactions. At the cellular level, indole-3-acetate, a derivative of tryptophan, functions as a signaling molecule influencing various pathways, including those related to cell growth, differentiation, and immune modulation. In the absence of known metabolites within this cluster, our interpretation leans on the inferred evidence, which suggests involvement of cellular compartments such as the cytoplasm and extracellular spaces. The presence of functionally related but structurally uncharacterized metabolites, similar to alpha-Amyrone and Indole-3-acetylglutamic acid, hints at potential roles in membrane dynamics and extracellular signaling. These metabolites may participate in pathways that modulate membrane remodeling and cellular communication, likely influencing processes like cellular adhesion and signal transduction. Additionally, the mention of enteral roles for Indole-3-acetylglutamic acid suggests a connection to gut-related metabolic activities, possibly impacting nutrient absorption and microbial interactions. This cluster, while lacking direct structural identification, appears to be intricately linked to pathways that govern cellular homeostasis and intercellular communication, underscoring the complexity and systemic nature of indole-3-acetate metabolism.",8,"18538731,33601415,36858045"
"pancreas",3,"Arginine and proline metabolism","Arginine and proline metabolism is a crucial cellular process involved in various physiological roles, including protein synthesis, nitric oxide production, and the urea cycle. This metabolic pathway is essential for maintaining cellular homeostasis, regulating immune function, and facilitating wound healing through collagen synthesis. Although no known metabolites have been structurally identified in Cluster 3, the inferred functional evidence suggests potential involvement of related metabolic activities. For instance, the presence of (+)-gamma-Hydroxy-L-homoarginine and S-Nitrosopenicillamine, both organic acids and derivatives, hints at possible alterations in nitric oxide signaling or amino acid derivative pathways, which are critical in vascular function and immune responses. Additionally, fibrinopeptide B, although not directly linked to arginine and proline metabolism, suggests possible interactions with coagulation pathways, which are often interconnected with inflammatory responses and tissue repair mechanisms. The presence of glucosylgalactosyl hydroxylysine, a fatty acyl glycoside, might indicate modifications in membrane lipid composition or signaling cascades involving glycosylation processes. These functionally related but structurally uncharacterized metabolites suggest a complex interplay of pathways that may influence cellular energy flux, membrane remodeling, and inflammatory signaling, potentially contributing to the observed differences between case and control groups.",12,"37804830,40185095,39051546"
"skin_of_back",1,"Fatty acid metabolism","Fatty acid metabolism is a crucial cellular process involving the breakdown and synthesis of fatty acids to maintain energy homeostasis and support various biological functions, such as membrane remodeling and signaling. This process primarily occurs in the mitochondria and peroxisomes, where fatty acids are oxidized to generate acetyl-CoA, which then enters the citric acid cycle to produce ATP. While this cluster lacks known metabolites, the inferred evidence suggests a focus on intermediates involved in fatty acid oxidation and modification. The presence of acyl carnitines, such as those similar to (10Z,12E)-4-Hydroxytrtradeca-10,12-dienylcarnitine, indicates active transport of fatty acids into mitochondria for β-oxidation. Similarly, compounds like (3E,5Z,8Z)-Tetradecatrienoyl-CoA suggest involvement in the elongation or desaturation of fatty acids, critical for producing polyunsaturated fatty acids that are key components of cell membranes and precursors to signaling molecules. The presence of long-chain hydroxy and oxo fatty acyl carnitines further supports the notion of ongoing lipid remodeling and signaling processes. These functionally related but structurally uncharacterized metabolites likely participate in pathways such as the carnitine shuttle, fatty acid β-oxidation, and possibly the synthesis of bioactive lipids, which are essential for maintaining cellular energy balance and responding to metabolic demands.",14,"23791484,26499846,31819192"
"skin_of_back",2,"Glycerophospholipid metabolism","Glycerophospholipid metabolism is a crucial cellular process involved in the synthesis and remodeling of membrane lipids, impacting both structural integrity and signaling functions within cells. Although no known metabolites anchor this cluster, inferred evidence suggests involvement in pathways like de novo triacylglycerol biosynthesis, with potential implications in energy storage and membrane dynamics. The presence of functionally related but structurally uncharacterized metabolites, such as those resembling PE(20:0/LTE4) and PA(20:0/LTE4), indicates a role in lipid signaling and inflammatory responses, possibly through leukotriene pathways. These metabolites, part of the lipid superclass, suggest active participation in membrane remodeling and the regulation of cellular responses to external stimuli. Additionally, the involvement of acyl cholines like 9-Decenoylcholine points to choline metabolism's role in neurotransmission and membrane stability. The inferred presence of diacylglycerol kinase alpha in this metabolic context highlights its role in converting diacylglycerol to phosphatidic acid, a key step in lipid signaling and membrane biosynthesis. Collectively, these processes underscore the importance of glycerophospholipid metabolism in maintaining cellular homeostasis, modulating inflammatory responses, and facilitating energy flux, particularly under conditions of metabolic stress or disease states in the case group.",14,"35108060,37992400,36131016"
"skin_of_back",3,"Heme metabolism","Heme metabolism is a crucial biological process involving the synthesis, utilization, and degradation of heme, a vital component of hemoproteins such as hemoglobin, myoglobin, and various cytochromes. At the cellular level, heme plays a pivotal role in oxygen transport, electron transfer, and catalysis of biochemical reactions. Despite the absence of structurally identified metabolites in this cluster, inferred evidence suggests functional involvement in heme-related pathways. For instance, the presence of a metabolite identified as heme indicates potential alterations in heme biosynthesis or degradation pathways, which may be implicated in conditions like Xanthine Dehydrogenase Deficiency and Zellweger Syndrome. The identification of gamma-Glutamyllysine and Biotinyl-p-aminobenzoate, although structurally uncharacterized, implies a connection to amino acid metabolism and cofactor biosynthesis, respectively, which are integral to cellular functions and energy metabolism. Furthermore, the classification of some unknowns under organic acids and derivatives suggests potential roles in intermediary metabolism and cellular signaling. Collectively, these functionally related but structurally uncharacterized metabolites may reflect perturbations in heme metabolism and related pathways, impacting processes such as oxidative stress response, energy production, and cellular signaling, particularly under the experimental context of treatment or disease conditions.",20,"35508203,33152324,33685989"
"spleen",1,"Sphingolipid metabolism","Sphingolipid metabolism is a crucial cellular process involved in the structural integrity and functionality of cell membranes, as well as in signaling pathways that regulate cell growth, differentiation, and apoptosis. Although no structurally identified metabolites are present in this cluster, the process is typically anchored by key sphingolipids such as ceramides, sphingomyelins, and glycosphingolipids, which play vital roles in membrane dynamics and cellular signaling. In the absence of known metabolites, we rely on the inferred functional evidence to provide context. The presence of Lauroyl-CoA, a compound associated with organic acids and derivatives, suggests potential interactions with fatty acid metabolism, which is often intertwined with sphingolipid biosynthesis and degradation pathways. Additionally, the functional characterization of Hydroxysphingomyeline C22:1, despite being structurally uncharacterized, hints at its involvement in membrane-related processes, possibly influencing membrane fluidity and signaling cascades. These functionally related but structurally uncharacterized metabolites may participate in pathways such as the sphingomyelin-ceramide pathway, which is crucial for mediating cellular responses to stress and inflammation. Overall, this cluster likely represents a dynamic network of metabolites contributing to membrane remodeling and signaling, with potential implications in disease states characterized by altered sphingolipid metabolism.",22,"29147025,38367623,39112706"
"spleen",2,"Organosulfur compound metabolism","Organosulfur compound metabolism plays a crucial role in various cellular and tissue-level processes, primarily involving the synthesis and breakdown of sulfur-containing compounds. These processes are essential for maintaining cellular redox balance, detoxification, and the synthesis of critical biomolecules like coenzymes and vitamins. Although no structurally identified metabolites are present in Cluster 2, inferred evidence suggests functional similarities with known organosulfur compounds. For instance, Cystamine, a dialkyldisulfide, indicates potential involvement in thiol-disulfide exchange reactions, which are pivotal in maintaining protein structure and function through redox regulation. This process is integral to cellular defense mechanisms against oxidative stress and the modulation of signal transduction pathways. Additionally, the presence of functionally related but structurally uncharacterized metabolites, such as those similar to Urolithin-3-sulfate, suggests possible interactions with coumarin pathways, known for their roles in anti-inflammatory and antioxidant activities. The inferred presence of compounds like [Nitrilotris(methylene)]trisphosphonic acid and Nitrocellulose, although not directly related to sulfur metabolism, may indicate broader metabolic interactions, possibly affecting energy flux and membrane remodeling. Overall, this cluster highlights the complexity of organosulfur metabolism and its integration into broader metabolic networks, underscoring its significance in cellular homeostasis and response to environmental changes.",17,"35718080,29637452,36757873"
"stomach",1,"Secondary bile acid biosynthesis","Secondary bile acid biosynthesis is a crucial biological process that occurs primarily in the intestines, where it involves the transformation of primary bile acids into secondary bile acids by gut microbiota. This process plays a significant role in lipid digestion and absorption, cholesterol homeostasis, and the modulation of gut microbiota composition. Although no known metabolites were identified in Cluster 1, the inferred evidence suggests that the unknown metabolites are functionally related to trihydroxy bile acids and their derivatives, which are key intermediates in this biosynthetic pathway. These compounds, such as 3b,7b,12a-Trihydroxy-5a-Cholanoic acid and its isomers, are indicative of the complex transformations that primary bile acids undergo through microbial enzymatic activity, including dehydroxylation and epimerization. The involvement of these structurally uncharacterized metabolites suggests that they may participate in pathways associated with lipid metabolism and signaling cascades that regulate inflammatory responses and cellular homeostasis. The presence of these metabolites implies a dynamic interplay between host and microbial metabolism, influencing not only digestive processes but also systemic physiological functions. Understanding the role of these functionally related but structurally uncharacterized metabolites could provide insights into the metabolic alterations observed in the case versus control groups, potentially revealing novel biomarkers or therapeutic targets for diseases linked to bile acid dysregulation.",17,"39787217,38653239,29798856"
