"tissue","story","cluster_n"
"muscle","The integration of metabolomic data across the four identified functional modules—queuosine metabolism, glycerophospholipid metabolism, fatty acid metabolism, and chondroitin sulfate metabolism—reveals a complex network of metabolic cross-talk and compensatory mechanisms that may underpin the physiological alterations observed in the case versus control comparison. Despite the absence of structurally characterized metabolites, the functional clustering via MS2 provides compelling evidence for the biological roles of these metabolites, suggesting that they participate in critical metabolic pathways with potential implications for disease pathophysiology.

The metabolic phenotype emerging from this analysis suggests a systemic reorganization of key biochemical processes, likely reflecting an adaptive response to the underlying condition. The interplay between queuosine metabolism and glycerophospholipid metabolism, for instance, may indicate a compensatory mechanism where alterations in tRNA modification influence membrane dynamics and cellular signaling. The modification of tRNA by queuosine is crucial for protein synthesis fidelity, and any perturbations could necessitate adjustments in lipid membrane composition to maintain cellular homeostasis. This is supported by the inferred involvement of phosphatidylethanolamines and cardiolipins, which are integral to membrane structure and mitochondrial function, respectively. Such alterations could have tissue-specific effects, particularly in metabolically active organs like the liver and muscle, where energy demands and protein synthesis rates are high.

Furthermore, the integration of fatty acid metabolism with glycerophospholipid pathways suggests a feedback loop where energy production and membrane remodeling are closely coordinated. The inferred activity of fatty acid oxidation pathways highlights a potential shift towards increased lipid catabolism, possibly to meet heightened energy requirements or to compensate for impaired glycolytic flux. This metabolic rewiring could be particularly pronounced in tissues with high oxidative capacity, such as the heart and skeletal muscle, where efficient energy utilization is critical. The link between fatty acid metabolism and vitamin B6 metabolism further underscores the interconnectedness of these pathways, as coenzyme synthesis is vital for numerous enzymatic reactions involved in energy production and amino acid metabolism.

Chondroitin sulfate metabolism, although primarily associated with connective tissue integrity, may also intersect with lipid and energy metabolism. The potential involvement of iron metabolism and fatty acid ester processes suggests a broader role for chondroitin sulfate in cellular energy balance and membrane dynamics. The sulfation and degradation of glycosaminoglycans could be influenced by changes in redox status or lipid availability, reflecting a dynamic interplay between structural maintenance and metabolic flexibility. This could have significant implications for tissue resilience and inflammatory responses, particularly in joint tissues where chondroitin sulfate is abundant.

The structurally uncharacterized metabolites within these clusters, while unknown, are likely to represent novel intermediates or biomarkers of these metabolic pathways. Their functional similarity, as revealed by MS2 clustering, suggests that they play crucial roles in the observed metabolic phenotype. This highlights the potential for discovering new pathway intermediates that could provide deeper insights into the condition being studied.

In conclusion, the metabolic rewiring observed across these functional modules suggests a coordinated response to maintain cellular and tissue homeostasis in the face of metabolic perturbations. The cross-talk between queuosine, lipid, and glycosaminoglycan metabolism reflects a complex adaptive mechanism that may be central to the disease's pathophysiology. This integrative analysis not only enhances our understanding of the metabolic landscape but also opens avenues for identifying novel therapeutic targets and biomarkers, offering a glimpse into the intricate metabolic networks that sustain life.",4
"ovary","The integrative analysis of metabolomic data from our case versus control study reveals a complex network of metabolic interactions that underscore the dynamic nature of cellular processes in response to physiological or pathological stimuli. The clustering of metabolites into functional modules, despite the structural anonymity of many, provides a profound insight into the metabolic phenotype under investigation. The interplay between carnitine and glycerophospholipid metabolism suggests a coordinated regulation of lipid handling and membrane dynamics, critical for maintaining cellular energy homeostasis and structural integrity. The inferred presence of acyl carnitines and dimethylphosphatidylethanolamines points to enhanced fatty acid oxidation and membrane remodeling, potentially reflecting a compensatory mechanism to meet increased energy demands or to repair membrane damage.

The cross-talk between amino acid metabolism, both in the context of neurotransmitter synthesis and nitrogen balance, and purine metabolism highlights a broader metabolic adaptation. The involvement of pathways such as the urea cycle and glutamate metabolism, alongside disruptions in purine nucleotide synthesis, suggests a shift towards maintaining nitrogen homeostasis and supporting nucleotide turnover. This metabolic rewiring could be indicative of an increased need for protein synthesis and DNA repair, especially in tissues with high proliferative demands or under oxidative stress.

Biotin and carboxylic acid metabolism further integrate into this metabolic network, with biotin's role in carboxylation reactions influencing fatty acid synthesis and gluconeogenesis, while carboxylic acids contribute to energy production and biosynthetic pathways. The potential alterations in these pathways may reflect an adaptive response to optimize energy utilization and biosynthetic capacity, particularly in energy-intensive tissues such as the liver and muscle.

The involvement of carbamazepine and furan metabolism suggests a detoxification response, with the cytochrome P450 enzyme system playing a pivotal role in the oxidative metabolism of xenobiotics. This detoxification process could be crucial in mitigating the toxic effects of environmental and dietary compounds, thereby maintaining cellular homeostasis. The structural uncharacterization of many metabolites in these clusters does not detract from their functional significance; rather, it highlights the potential discovery of novel intermediates or biomarkers that could redefine our understanding of these metabolic pathways.

Chondroitin sulfate biosynthesis, with its implications for extracellular matrix integrity, suggests a tissue-specific adaptation, particularly in connective tissues. The modulation of glycosaminoglycan synthesis pathways may be critical for tissue repair and inflammation regulation, providing resilience against mechanical stress and injury.

Collectively, these metabolic alterations suggest a systemic response characterized by enhanced lipid and amino acid metabolism, detoxification processes, and extracellular matrix remodeling. This metabolic phenotype may reflect an organism-wide effort to maintain energy balance, support cellular proliferation, and protect against external stressors. The observed metabolic rewiring implies a potential underlying mechanism where increased energy flux and biosynthetic activity are prioritized to sustain cellular function and resilience in the face of disease or treatment-induced challenges. This systems-level understanding not only provides a comprehensive view of metabolic adaptations but also opens avenues for identifying novel therapeutic targets and biomarkers for the condition under study.",10
"pancreas","The metabolomic analysis of case versus control samples, employing MS2 functional clustering, has unveiled three distinct yet interrelated metabolic clusters: glycerophospholipid metabolism, indole-3-acetate metabolism, and arginine and proline metabolism. Despite the absence of structurally characterized metabolites within these clusters, the functional insights provided by the clustering reveal a complex metabolic phenotype characterized by altered lipid signaling, amino acid metabolism, and potential inter-organ communication, which may underpin the pathophysiology of the studied condition.

The glycerophospholipid metabolism cluster, although devoid of known metabolites, suggests significant alterations in membrane dynamics and inflammatory signaling. This cluster's inferred involvement in pathways such as arachidonic acid metabolism and phospholipase activity implies a heightened state of membrane remodeling and lipid mediator production, which could be pivotal in inflammatory responses. The potential cross-talk with the arginine and proline metabolism cluster is particularly intriguing. Arginine metabolism is known for its role in nitric oxide production, a critical mediator of vascular function and immune response. The interplay between glycerophospholipid-derived lipid mediators and nitric oxide signaling may represent a compensatory mechanism to modulate inflammation and maintain cellular homeostasis under stress conditions.

The indole-3-acetate metabolism cluster, although traditionally associated with plant systems, highlights the role of tryptophan derivatives in mammalian physiology, particularly in the gut. This cluster's potential involvement in modulating membrane dynamics and extracellular signaling suggests a broader systemic impact, possibly influencing nutrient absorption and gut microbiota interactions. The cross-talk between indole-3-acetate metabolism and arginine metabolism may further extend to immune modulation, as both pathways are implicated in regulating cellular communication and immune responses. This interaction could be critical in tissues where immune surveillance and response are paramount, such as the gut and liver.

The overarching metabolic phenotype emerging from this analysis suggests a systemic shift towards enhanced membrane remodeling, altered signaling cascades, and immune modulation. These changes could manifest as tissue-specific effects, particularly in organs with high metabolic activity or those involved in immune surveillance, such as the liver, gut, and vascular endothelium. The potential organ cross-talk, facilitated by shared signaling pathways and metabolic intermediates, underscores the complexity of the disease state and highlights the dynamic interplay between different metabolic processes.

The structurally uncharacterized metabolites within these clusters, while currently unknown, likely represent novel intermediates or biomarkers of the metabolic reprogramming observed. Their functional similarity, as revealed by MS2 clustering, suggests that these metabolites participate in critical biological roles, potentially offering new insights into the disease mechanism or therapeutic targets. The presence of these unknowns emphasizes the need for further structural characterization and functional validation to fully elucidate their roles in the observed metabolic phenotype.

In conclusion, the metabolic rewiring observed in this study suggests a hypothesis where the interplay between lipid signaling, amino acid metabolism, and gut-derived metabolites drives a coordinated response to maintain cellular and systemic homeostasis. This response may involve compensatory mechanisms to counteract inflammation and stress, with potential implications for disease progression or therapeutic intervention. The integration of these metabolic pathways highlights the importance of a systems-level approach in understanding complex biological conditions and underscores the potential of metabolomics to uncover novel insights into disease mechanisms.",3
"skin_of_back","The integrative metabolomic analysis presented in this study reveals a complex interplay between glycerophospholipid, fatty acid, and heme metabolism, suggesting a coordinated metabolic reprogramming in the context of the condition under investigation. The clustering of metabolites into functional modules, despite their structural uncharacterization, provides a compelling narrative of metabolic cross-talk and compensatory mechanisms that underpin the observed phenotype.

Glycerophospholipid metabolism emerges as a central hub, influencing membrane dynamics and signaling pathways. The presence of metabolites resembling phosphatidylethanolamines and phosphatidic acids, albeit unknown, points to active lipid remodeling and signaling, potentially mediated by diacylglycerol kinase activity. This process is likely pivotal in maintaining cellular membrane integrity and modulating inflammatory responses, particularly in tissues experiencing metabolic stress. The inferred involvement of acyl cholines further suggests a role in neurotransmission and membrane stability, highlighting the importance of choline metabolism in cellular communication.

Simultaneously, fatty acid metabolism appears to be intricately linked with glycerophospholipid pathways, with a focus on fatty acid oxidation and modification. The transport of fatty acids into mitochondria via the carnitine shuttle and subsequent β-oxidation underscores the cell's efforts to meet energy demands and maintain homeostasis. This metabolic flux not only supports ATP production but also provides substrates for lipid biosynthesis, thus feeding back into glycerophospholipid metabolism. The elongation and desaturation of fatty acids suggest an adaptive response to produce polyunsaturated fatty acids, crucial for membrane fluidity and as precursors to signaling molecules.

Heme metabolism, though less directly connected, contributes to the overall metabolic phenotype by modulating oxidative stress and energy production. The presence of metabolites linked to heme biosynthesis and degradation pathways, despite being structurally uncharacterized, indicates potential alterations in redox balance and electron transport. This could reflect a compensatory mechanism to mitigate oxidative damage and support the increased metabolic demands observed in the case group.

The collective metabolic phenotype suggests a state of enhanced lipid turnover and energy metabolism, likely driven by the need to adapt to pathological conditions. This metabolic rewiring may be particularly pronounced in tissues with high energy demands or those involved in immune responses, such as the liver, muscle, or immune cells. The cross-talk between these metabolic pathways highlights a coordinated effort to maintain cellular function and resilience in the face of disease-induced stress.

The structural uncharacterization of many metabolites within these clusters should not detract from their biological significance. The functional clustering via MS2 analysis provides a window into their likely roles, suggesting that these unknowns may represent novel intermediates or biomarkers of the condition. This underscores the potential for discovering new therapeutic targets or diagnostic markers that could enhance our understanding and treatment of the disease.

In conclusion, the observed metabolic reprogramming suggests a hypothesis wherein the condition induces a shift towards enhanced lipid metabolism and oxidative stress management. This may reflect an adaptive response to maintain cellular homeostasis and energy balance, albeit at the cost of increased metabolic strain. The integration of glycerophospholipid, fatty acid, and heme metabolism reveals a complex network of interactions that could offer new insights into the underlying mechanisms of the disease, paving the way for future research and therapeutic interventions.",3
"spleen","The integration of sphingolipid and organosulfur compound metabolism, as revealed through MS2 functional clustering, provides a compelling narrative of metabolic cross-talk that underscores the complexity of cellular homeostasis and its perturbation in disease states. While both clusters are composed predominantly of structurally uncharacterized metabolites, their functional characterization allows us to infer significant biological roles and interactions. This study highlights a potential compensatory mechanism between these two metabolic modules, suggesting a dynamic interplay that may influence disease progression and tissue-specific responses.

Sphingolipid metabolism, represented by Cluster 1, is intricately linked to cellular membrane integrity and signaling pathways. The inferred presence of metabolites involved in the sphingomyelin-ceramide pathway suggests a role in mediating cellular responses to stress and inflammation. This pathway is crucial for maintaining membrane dynamics and facilitating signal transduction that governs cell growth, differentiation, and apoptosis. The potential interaction with fatty acid metabolism, as indicated by the presence of Lauroyl-CoA, further emphasizes the interconnectedness of lipid metabolic pathways, which could be pivotal in modulating membrane fluidity and cellular signaling cascades.

In parallel, Cluster 2 highlights the significance of organosulfur compound metabolism, which is essential for maintaining cellular redox balance and detoxification processes. The involvement in thiol-disulfide exchange reactions underscores its role in protein structure maintenance and function through redox regulation. This is particularly relevant in the context of oxidative stress, where sulfur metabolism may provide a compensatory mechanism to counteract cellular damage. The potential interaction with coumarin pathways, known for their anti-inflammatory and antioxidant activities, suggests a broader network of metabolic interactions that may influence cellular defense mechanisms.

The cross-talk between these two metabolic modules may reflect a broader physiological adaptation to maintain cellular homeostasis under pathological conditions. The inferred metabolic phenotype suggests a shift towards enhanced membrane remodeling and redox regulation, potentially as a response to increased cellular stress or altered signaling demands. This metabolic rewiring could have tissue-specific effects, particularly in organs with high metabolic activity or those exposed to significant environmental stressors, such as the liver or heart. The interplay between sphingolipid and organosulfur metabolism may also facilitate organ cross-talk, where metabolites or signaling molecules produced in one tissue influence the function of another, thereby contributing to systemic metabolic regulation.

The presence of structurally uncharacterized metabolites, while challenging, offers an opportunity to explore novel pathway intermediates or potential biomarkers. These unknowns may represent critical nodes in the metabolic network that have yet to be fully elucidated, providing new insights into the underlying mechanisms of disease. The functional similarity revealed through MS2 clustering suggests that these metabolites, although uncharacterized, play significant roles in the metabolic landscape, potentially influencing disease etiology and progression.

In conclusion, the metabolic rewiring observed in this study points to a complex interaction between sphingolipid and organosulfur metabolism, with implications for cellular homeostasis and disease pathogenesis. The dynamic interplay between these pathways may reflect an adaptive response to maintain membrane integrity and redox balance under stress conditions. This systems-level perspective not only enhances our understanding of the metabolic phenotype associated with the condition but also opens avenues for further exploration of novel metabolic pathways and potential therapeutic targets.",2
"stomach","The integration of metabolomics data from the case versus control comparison reveals a compelling narrative of metabolic cross-talk between prenol lipid metabolism and secondary bile acid biosynthesis. These two functional modules, despite being composed predominantly of structurally uncharacterized metabolites, unveil a complex interplay that may underpin the physiological and pathological states observed in the study. The prenol lipid metabolism cluster, characterized by its involvement in isoprenoid biosynthesis and glycosylation pathways, suggests alterations in cellular processes essential for maintaining membrane integrity, protein maturation, and signaling. Concurrently, the secondary bile acid biosynthesis cluster highlights the gut microbiota's role in transforming primary bile acids, impacting lipid digestion, cholesterol homeostasis, and systemic metabolic regulation.

The cross-talk between these metabolic pathways likely reflects a compensatory mechanism or feedback loop aimed at maintaining cellular homeostasis. For instance, the prenol lipid metabolism's role in dolichol-linked glycosylation pathways may influence protein processing and membrane dynamics, which are critical for cellular signaling and metabolic regulation. This, in turn, could affect the gut-liver axis, where bile acids play a pivotal role in lipid absorption and cholesterol metabolism. The secondary bile acid biosynthesis cluster's involvement in lipid metabolism and signaling cascades suggests a feedback loop where alterations in bile acid profiles could modulate lipid signaling pathways, potentially compensating for disruptions in prenol lipid metabolism.

The overall metabolic phenotype observed in this study may reflect a systemic adaptation to maintain metabolic balance in the face of disease or treatment-induced perturbations. Tissue-specific effects are likely, with the liver and intestines being primary sites of metabolic activity. The liver, as a central hub for lipid metabolism and bile acid synthesis, may exhibit altered metabolic fluxes that influence systemic lipid homeostasis and inflammatory responses. The intestines, through microbial-mediated bile acid transformations, could further modulate systemic metabolic pathways, highlighting the importance of organ cross-talk in maintaining physiological equilibrium.

The presence of numerous structurally uncharacterized metabolites in both clusters underscores the potential for discovering novel pathway intermediates or biomarkers. The functional similarity revealed through MS2 clustering suggests these metabolites play significant biological roles, possibly representing previously unrecognized elements of metabolic pathways. This opens avenues for further exploration into their specific functions and contributions to the observed metabolic phenotype.

In conclusion, the metabolic rewiring observed in this study suggests a hypothesis where disruptions in prenol lipid metabolism and secondary bile acid biosynthesis reflect an adaptive response to maintain cellular and systemic homeostasis. The interplay between these pathways may influence disease progression or treatment outcomes, with potential implications for identifying novel therapeutic targets. By embracing the unknown and leveraging functional clustering, this study provides valuable insights into the complex metabolic networks that govern physiological and pathological states, offering a foundation for future research into the metabolic underpinnings of disease.",2
