"tissue","cluster_id","functional_name","report","feature_count","pmids"
"ileocecum",7,"Biotin metabolism","Biotin metabolism plays a crucial role in cellular and tissue-level processes by acting as a coenzyme for carboxylase enzymes, which are essential for fatty acid synthesis, amino acid metabolism, and gluconeogenesis. Although no structurally identified metabolites are present in Cluster 7, the inferred functional evidence provides insights into related biochemical pathways. For instance, the presence of organoheterocyclic compounds like sulfosuccinimidyl 6-(biotinamido)hexanoate suggests potential interactions with biotin derivatives, which are integral to carboxylation reactions. The involvement of organonitrogen compounds, such as N-Nitrosobis(2-oxopropyl)amine, hints at nitrogen metabolism interplay, potentially affecting amino acid catabolism. Additionally, the presence of fatty acyl thioesters, exemplified by 3-oxopentanoyl-CoA, indicates connections to lipid metabolism, possibly influencing membrane remodeling or energy flux through beta-oxidation. The mention of nitrosoperoxycarbonate suggests oxidative stress pathways might also be relevant, potentially impacting redox balance and signaling cascades. Collectively, these functionally related but structurally uncharacterized metabolites suggest that biotin metabolism in this context may be intricately linked to broader metabolic and signaling networks, including lipid synthesis, amino acid turnover, and oxidative stress response, all of which are crucial for maintaining cellular homeostasis and adapting to physiological changes in the case versus control experimental setup.",17,"34295297,38928282"
"ileocecum",8,"De Novo Triacylglycerol Biosynthesis","De novo triacylglycerol biosynthesis is a critical metabolic process in which cells synthesize triacylglycerols (TAGs) from simpler precursors. This process is essential for energy storage, membrane lipid remodeling, and the generation of lipid signaling molecules. Although no known metabolites have been structurally identified in Cluster 8, the functional evidence suggests the involvement of lysophosphatidic acids (LysoPAs), such as LysoPA(i-13:0/0:0), LysoPA(i-21:0/0:0), LysoPA(i-19:0/0:0), and LysoPA(i-22:0/0:0). These LysoPAs are intermediates in the biosynthesis of TAGs, where they serve as precursors for the formation of phosphatidic acid, a key intermediate that is subsequently converted to diacylglycerol and finally to triacylglycerol. The presence of these functionally related but structurally uncharacterized metabolites suggests active lipid remodeling and energy storage processes, particularly in response to cellular demands or external stimuli. Additionally, the inferred involvement of glycylleucine, an amino acid derivative, hints at potential interactions between lipid and protein metabolism, possibly influencing signaling pathways or metabolic regulation. Overall, the de novo triacylglycerol biosynthesis pathway is integral to maintaining cellular energy homeostasis and membrane integrity, with implications for metabolic disorders and conditions characterized by altered lipid metabolism.",29,"24814684,25415055,40533558"
"ileocecum",9,"Nitrogen metabolism","Nitrogen metabolism is a fundamental biological process that involves the transformation and utilization of nitrogenous compounds within cells and tissues. This process is crucial for synthesizing amino acids, nucleotides, and other nitrogen-containing biomolecules, which are essential for cellular growth, repair, and signaling. Despite the absence of structurally identified metabolites in Cluster 9, the inferred functional evidence suggests involvement in nitrogen metabolism through the presence of structurally uncharacterized metabolites. These metabolites, such as those functionally related to organic acids and morpholine derivatives, may participate in pathways like amino acid biosynthesis and degradation, nitrogen assimilation, and the urea cycle. The presence of compounds akin to N-Nitrosomorpholine, a morpholine derivative, hints at potential interactions with nitrogen-containing compounds, possibly affecting nitrogen homeostasis or detoxification processes. Additionally, the involvement of pentacarboxylic acid derivatives suggests a role in complex organic acid metabolism, which could intersect with nitrogen metabolism through transamination reactions or the synthesis of nitrogenous bases. Overall, this cluster may reflect changes in nitrogen metabolism pathways, potentially influencing cellular processes such as energy production, redox balance, and cellular signaling in the context of the experimental treatment or disease state.",6,"37009798,32943735,32978521"
"ileocecum",10,"Pectin degradation","Pectin degradation is a critical biological process primarily involved in the breakdown of pectin, a complex polysaccharide found in plant cell walls, into simpler molecules. This process is essential for cellular activities such as cell wall remodeling, plant growth, and defense responses. In the context of metabolic profiling, the absence of known metabolites in Cluster 10 suggests that the specific metabolic intermediates involved in pectin degradation remain structurally uncharacterized. However, inferred evidence points to the involvement of enzymes such as UDP-glucuronosyltransferase 1-4 and 2B7, which catalyze reactions involving pectic acid, a primary component of pectin. This suggests that the functional module may be linked to the modification and breakdown of pectic substances, potentially influencing pathways related to carbohydrate metabolism and cellular signaling. Additionally, the presence of functionally related but structurally uncharacterized metabolites, such as those resembling lactones and alcohols, hints at complex biochemical transformations that might involve esterification or oxidation-reduction reactions. The detection of benzene derivatives and polyols in blood further suggests systemic involvement, possibly reflecting the transport or signaling roles of pectin-derived metabolites. Overall, this cluster likely represents a nuanced interplay of metabolic pathways that facilitate the degradation and utilization of pectin, contributing to broader cellular processes such as energy flux and membrane remodeling.",6,"9067088,39030909,24798790"
"ileocecum",11,"Lignan metabolism","Lignan metabolism is a crucial biological process involved in the biosynthesis and degradation of lignans, which are a type of polyphenolic compounds found in plants. These compounds are known for their antioxidant properties and potential health benefits, including anti-cancer, anti-inflammatory, and cardioprotective effects. At the cellular level, lignan metabolism facilitates the conversion of plant-derived lignans into bioactive mammalian lignans through microbial action in the gut. This transformation is significant for modulating various physiological processes, such as hormone regulation and cellular signaling pathways. Although no known metabolites anchor Cluster 11, inferred evidence suggests a functional association with lignan-related compounds. For instance, dihydroguaiaretic acid, a dibenzylbutane lignan, indicates involvement in lignan biosynthesis or catabolism. This aligns with the broader metabolic pathways of lignans, neolignans, and related compounds, which are critical for maintaining cellular redox balance and modulating inflammatory responses. Additionally, the presence of functionally related but structurally uncharacterized metabolites suggests potential interactions with barbituric acid derivatives and pyrimidine nucleosides, hinting at complex metabolic networks that may influence cellular energy dynamics and nucleic acid metabolism. Overall, lignan metabolism likely intersects with pathways involved in oxidative stress response and hormonal signaling, underscoring its importance in maintaining cellular homeostasis and contributing to the organism's overall health.",7,"10384816,30114639,17943494"
"ileocecum",12,"Thionucleoside metabolism","Thionucleoside metabolism plays a pivotal role in cellular and tissue-level processes by modulating nucleotide pools and influencing nucleic acid synthesis and repair. Although no structurally identified metabolites anchor Cluster 12, the inferred evidence suggests involvement in pathways related to modified nucleosides. Thionucleosides, characterized by the substitution of oxygen with sulfur in the ribose moiety, are integral to the regulation of nucleic acid stability and function. The presence of compounds related to 5'-deoxy-5'-thionucleosides and purine ribonucleotides, such as adenosine thiamine diphosphate, indicates a potential link to energy metabolism and redox reactions. These metabolites may participate in nucleotide salvage pathways and the synthesis of sulfur-containing biomolecules, critical for maintaining cellular homeostasis and response to oxidative stress. Furthermore, the involvement of functionally related but structurally uncharacterized metabolites, such as those linked to 5'-deoxyribonucleosides, suggests a role in DNA and RNA processing, possibly affecting gene expression and cellular signaling. The metabolic pathways implicated in this cluster likely intersect with sulfur metabolism and purine metabolism, highlighting their importance in cellular proliferation and stress responses. This functional module may be particularly relevant in contexts where thionucleoside metabolism is dysregulated, such as in certain diseases or under specific treatment conditions, impacting cellular resilience and adaptation mechanisms.",5,"18538731,33601415,36858045"
"ileocecum",13,"Retinoid metabolism","Retinoid metabolism plays a crucial role in cellular and tissue-level processes by regulating the synthesis and degradation of retinoic acid, a key signaling molecule derived from vitamin A. This metabolic pathway is integral to cellular differentiation, proliferation, and apoptosis, impacting vision, immune function, and skin health. Although no structurally identified metabolites anchor this cluster, inferred functional evidence suggests the involvement of glycosylation and glucuronidation processes, which are common in retinoid metabolism for enhancing solubility and facilitating excretion. The presence of 4-Hydroxyretinoic acid glucuronide implies a role in the detoxification and clearance of retinoic acid derivatives, aligning with known pathways where glucuronides are conjugated to retinoids for excretion. The involvement of UDP-glucuronosyltransferase 2B7 further supports this detoxification process, as it catalyzes the glucuronidation of various substrates including retinoids. Functionally related but structurally uncharacterized metabolites, such as those classified under O-glycosyl compounds and carbohydrates, suggest additional layers of metabolic regulation, potentially influencing retinoid bioavailability and signaling. These processes collectively underscore the intricate balance maintained by retinoid metabolism in modulating cellular responses and maintaining homeostasis through pathways such as the retinoic acid signaling cascade and its interaction with nuclear receptors.",7,"37184371,32899684,22153757"
"ileocecum",14,"Retinol metabolism","Retinol metabolism is a critical biological process primarily involved in the regulation of vision, cellular differentiation, and immune function. At the cellular level, retinol, a form of vitamin A, is metabolized into active derivatives such as retinal and retinoic acid, which play essential roles in gene expression and cellular signaling. Although no known metabolites have been identified in this cluster, the inferred functional evidence suggests a connection to retinol metabolism. For instance, 11-cis-Retinyl palmitate, a retinol ester, is crucial for the storage and transport of vitamin A, highlighting its role in maintaining retinol homeostasis. The presence of functionally related but structurally uncharacterized metabolites, such as those resembling Retinyl dodecanoate, suggests involvement in lipid transport and storage, as these compounds are typically found in body fluids like blood. Additionally, the mention of Vitamin A2 aldehyde, a lipid-like molecule, supports the notion of its involvement in cellular signaling pathways, potentially influencing processes like cell differentiation and proliferation. These metabolites likely participate in the retinoid signaling pathway, crucial for vision and cellular growth. The presence of steroid derivatives, such as (22alpha)-hydroxy-isofucosterol, further suggests a broader interaction with lipid metabolism and signaling cascades. Overall, this cluster underscores the complexity of retinol metabolism, involving storage, transport, and conversion of vitamin A derivatives, which are vital for maintaining cellular function and systemic health.",3,"37184371,36864033,10637381"
"ileocecum",15,"Steroid hormone biosynthesis","Steroid hormone biosynthesis is a critical biological process that occurs in various tissues, including the adrenal glands, gonads, and placenta, where it is responsible for the production of steroid hormones such as glucocorticoids, mineralocorticoids, and sex steroids. These hormones play vital roles in regulating metabolism, immune function, water balance, and reproductive processes. In this cluster, although no known metabolites have been structurally identified, the inferred presence of metabolites like Clascoterone, which is categorized under steroids and steroid derivatives, suggests a potential involvement in steroidogenic pathways. Clascoterone's classification as a 21-hydroxysteroid indicates its possible role in the biosynthesis of corticosteroids, which are crucial for stress response and metabolic regulation. The presence of functionally related but structurally uncharacterized metabolites, such as those resembling Triethylenephosphoramide and Fosteabine, may point towards ancillary pathways that interact with or modulate steroid hormone biosynthesis. For instance, organic phosphoric acids and derivatives like Triethylenephosphoramide could be involved in phosphorylation events that regulate enzyme activity within these pathways. Additionally, the potential involvement of sesquiterpenoids, as indicated by Petasalbin, may suggest interactions with lipid signaling pathways that influence steroid hormone function. Overall, this cluster highlights the complexity and interconnectivity of metabolic and signaling pathways that underpin steroid hormone biosynthesis, emphasizing the need for further structural characterization to fully elucidate these processes.",6,"31362062,37277481,25465475"
"ileocecum",16,"Carnitine metabolism","Carnitine metabolism plays a crucial role in cellular energy homeostasis by facilitating the transport of long-chain fatty acids into the mitochondria for β-oxidation, a process critical for ATP production. Although no structurally identified metabolites anchor this cluster, the inferred presence of acyl carnitines, such as 3-Hydroxybutyrylcarnitine, suggests a focus on energy metabolism and potential disruptions in fatty acid oxidation. Acyl carnitines are pivotal in shuttling fatty acids across mitochondrial membranes, thus linking carnitine metabolism to pathways like fatty acid β-oxidation and ketogenesis. The involvement of 3-Hydroxybutyrylcarnitine, associated with metabolic disorders like 3-Hydroxyacyl-CoA dehydrogenase deficiency, implies a possible dysfunction in these pathways under the experimental conditions. The functionally related but structurally uncharacterized metabolites, inferred to be similar to compounds like 2-Ethyl-2-hydroxybutanedioylcarnitine, further suggest alterations in lipid metabolism, potentially impacting energy flux and metabolic flexibility. This cluster may reflect adaptive or maladaptive responses in energy utilization, particularly in conditions where energy demand and supply are imbalanced, such as in metabolic diseases or during specific treatments. Understanding these dynamics is vital for elucidating the metabolic shifts occurring in the case versus control groups, potentially pointing to therapeutic targets or biomarkers for metabolic health.",7,"23563705,36632072,28508995"
"ileocecum",17,"Histamine metabolism","Histamine metabolism is a crucial biological process involved in the regulation of immune responses, gastric acid secretion, and neurotransmission. At the cellular level, histamine is synthesized from the amino acid histidine by the enzyme histidine decarboxylase and is subsequently metabolized by methylation via histamine N-methyltransferase or by oxidative deamination via diamine oxidase. Although no structurally identified metabolites are present in Cluster 17, the inferred functional evidence suggests a potential involvement of aromatic-L-amino-acid decarboxylase, which is known to act on histamine, highlighting its role in the decarboxylation process within the histamine metabolic pathway. The presence of compounds like mizoribine and imidazopyrimidines, although not directly linked to histamine metabolism, may indicate interactions or parallel pathways that influence histamine's biological roles. Additionally, the detection of acetyl chloride in body fluids suggests potential acetylation reactions that could modulate histamine activity or its degradation products. These functionally related but structurally uncharacterized metabolites may participate in or regulate histamine's involvement in inflammatory signaling, allergic responses, or neurotransmitter modulation. Overall, while the specific pathways remain partially uncharacterized due to the lack of known metabolites, the inferred evidence supports the notion of a complex interplay of metabolic and signaling pathways centered around histamine's diverse physiological roles.",7,"10344773,13866127,14391927"
"ileocecum",18,"Milbemycin metabolism","Milbemycin metabolism, although lacking structurally identified metabolites in this cluster, can be inferred to play a significant role in modulating cellular processes related to macrolide activities. Milbemycins, as a class, are known for their potent anthelmintic and insecticidal properties, primarily through their ability to disrupt neurotransmission in parasites by modulating chloride ion channels. This suggests that the functional module represented by Cluster 18 may be involved in processes related to neurochemical signaling and ion transport regulation. The inferred presence of compounds such as Milbemycin alpha5, alpha6, and alpha9, all belonging to the milbemycin family, supports the hypothesis that this cluster is involved in pathways regulating ion channel function and potentially influencing membrane dynamics. These processes are crucial for maintaining cellular homeostasis and could impact broader physiological responses such as immune modulation and inflammation control. The involvement of phenylpropanoids and polyketides, as suggested by the superclass of Milbemycin alpha9, further indicates a role in secondary metabolite pathways that might intersect with detoxification processes or oxidative stress responses. Functionally related but structurally uncharacterized metabolites in this cluster likely contribute to these pathways, enhancing the metabolic network's capacity to manage exogenous and endogenous stressors. Overall, Milbemycin metabolism appears to be a critical component of cellular defense mechanisms and signaling cascades that maintain organismal health.",11,"18538731,33601415,36858045"
"kidney",1,"Steroid biosynthesis","Steroid biosynthesis is a critical cellular process responsible for the production of steroid hormones, which play essential roles in regulating various physiological functions, including metabolism, immune response, and reproductive activities. This process involves the conversion of cholesterol into steroid hormones through a series of enzymatic reactions occurring in the mitochondria and endoplasmic reticulum of cells. Although no known metabolites have been identified in Cluster 1, the inferred functional evidence suggests the involvement of sterol lipids, as indicated by the similarity to compounds like 24beta-Ethyl-25(27)-dehydrolophenol, a derivative of stigmastanes. This points to the potential involvement of sterol intermediates in the steroid biosynthesis pathway. Additionally, the presence of compounds like Fenoprofen glucuronide, an O-glucuronide, suggests potential interactions with glucuronidation pathways, which are important for the metabolism and excretion of steroid hormones. The functional descriptions of other uncharacterized metabolites, such as those falling under organic oxygen compounds and organooxygen compounds, may indicate auxiliary roles in oxidative processes or structural modifications of steroid precursors. Overall, the cluster may represent a functional module involved in the synthesis and modification of steroid hormones, potentially influencing pathways such as lipid metabolism and hormone signaling cascades. These processes are crucial for maintaining cellular homeostasis and responding to physiological changes in the case versus control groups.",12,"31362062,25465475,31588535"
"kidney",2,"Vitamin D metabolism","Vitamin D metabolism is a critical biological process involved in maintaining calcium and phosphate homeostasis, which is essential for bone health and cellular function. Although no known metabolites anchor this cluster, the inferred presence of 24-Oxo-1alpha,25-dihydroxyvitamin D3 suggests involvement in the pathways of Vitamin D activation and degradation. This metabolite is part of the Vitamin D and derivatives subclass, indicating its role in the regulation of calcium absorption and bone mineralization. The presence of functionally related but structurally uncharacterized metabolites, such as those associated with organooxygen compounds and membrane-related activities, suggests potential interactions with cellular membranes, possibly influencing Vitamin D receptor (VDR) activation or signaling pathways. Additionally, the detection of aminohydroxyacetic acid in blood and L-Cysteinylglycine disulfide in the cytoplasm points towards a broader metabolic network involving amino acid metabolism and redox balance, which could be implicated in modulating Vitamin D metabolism. These interactions may affect processes such as membrane remodeling and energy flux, integral to maintaining cellular homeostasis. Overall, the cluster suggests an intricate interplay of metabolic pathways that support Vitamin D's role in cellular signaling and systemic physiological regulation, with potential implications for understanding treatment or disease-related alterations in Vitamin D metabolism.",10,"29657326,38676447,22716179"
"kidney",3,"Biotin metabolism","Biotin metabolism plays a crucial role in cellular and tissue-level processes by acting as a coenzyme for carboxylase enzymes, which are essential for fatty acid synthesis, amino acid catabolism, and gluconeogenesis. Although there are no structurally identified metabolites in Cluster 3, the inferred presence of biotin-related compounds such as Biotin sulfoxide and Biotin amide suggests an active participation in the biotin metabolic pathway. Biotin sulfoxide, an oxidized form of biotin, may indicate oxidative stress conditions or the regulation of biotin availability, impacting enzyme activity and metabolic flux. The presence of Biotin amide, another derivative, further supports the involvement of biotin-related processes, potentially influencing the subcellular localization and function of biotin-dependent enzymes. Additionally, functionally related but structurally uncharacterized metabolites like Glutaminyllysine and Cysteinyl-Histidine suggest interactions with protein synthesis and degradation pathways, possibly affecting protein turnover and cellular homeostasis. The reference to Nitrogen mustard N-oxide, though less directly related, might imply cellular responses to stress or damage, linking to broader metabolic adjustments. Overall, these findings highlight the interconnectedness of biotin metabolism with lipid and amino acid pathways, emphasizing its role in maintaining cellular energy balance and metabolic flexibility, particularly under varying physiological or pathological conditions.",11,"38928282,19319844"
