"tissue","story","cluster_n"
"adipose","The integrative analysis of metabolomic data through MS2 functional clustering has unveiled a complex web of metabolic interactions that extend beyond the individual functional modules identified in this study. The absence of structurally characterized metabolites within each cluster underscores the potential of these unknown entities to reveal novel insights into metabolic processes, particularly in the context of disease or altered physiological states. The cross-talk between the identified functional modules—carnitine metabolism, fatty acid ester metabolism, biotin metabolism, and steroid hormone biosynthesis—suggests a coordinated metabolic response that may underpin the overall metabolic phenotype observed in the case group.

Carnitine metabolism, as inferred from Cluster 3, plays a pivotal role in energy homeostasis by facilitating the transport of fatty acids into mitochondria for β-oxidation. This process is intricately linked to fatty acid ester metabolism (Cluster 4), where the conversion of fatty acids into esterified forms supports energy storage and membrane integrity. The interplay between these modules suggests a compensatory mechanism that balances energy production and storage, potentially in response to metabolic stress or increased energy demands. The inferred presence of acyl carnitines and fatty acid esters highlights their roles in modulating lipid metabolism and energy flux, which are crucial for maintaining cellular homeostasis.

Biotin metabolism (Cluster 1) further integrates into this metabolic network by supporting carboxylation reactions essential for gluconeogenesis and fatty acid synthesis. The functional involvement of biotin-related pathways suggests an adaptive response to maintain energy production and metabolic flexibility, particularly under conditions where traditional energy sources may be limited. This is complemented by the steroid hormone biosynthesis module (Cluster 2), where the synthesis of steroid derivatives may influence inflammatory signaling and immune function, processes that are often dysregulated in disease states. The potential involvement of vitamin D analogs and other lipid-like molecules in this cluster points to a broader role in calcium homeostasis and systemic metabolic regulation.

The physiological context of these findings suggests that the overall metabolic phenotype observed in the case group may be characterized by enhanced lipid mobilization, altered energy metabolism, and shifts in signaling pathways related to inflammation and immune function. These changes may reflect tissue-specific effects, such as increased fatty acid oxidation in muscle or liver tissues, and organ cross-talk, particularly between the liver, adipose tissue, and endocrine organs. The functional similarities revealed by MS2 clustering, despite the structural unknowns, indicate that these metabolites likely participate in critical biological roles, potentially as novel intermediates or biomarkers of metabolic dysregulation.

Embracing the unknowns, the structurally uncharacterized metabolites within each cluster may represent novel pathway intermediates that bridge existing metabolic pathways or highlight previously unrecognized feedback loops. Their functional similarity suggests that they could play crucial roles in modulating metabolic responses, offering new avenues for understanding the underlying mechanisms of disease. The metabolic rewiring observed in this study points to a hypothesis that the condition may involve a coordinated shift towards optimizing energy utilization and maintaining metabolic balance in the face of altered physiological demands. This integrative systems-level view provides a foundation for future research aimed at elucidating the precise roles of these unknown metabolites and their potential as therapeutic targets or diagnostic markers in metabolic disorders.",4
"adrenal_gland","The metabolomics analysis presented here reveals a complex interplay of metabolic pathways, highlighting the intricate cross-talk between various functional modules that underpin the observed physiological phenotype. Despite the structural ambiguity of many metabolites, their functional clustering via MS2 provides compelling insights into their biological roles, suggesting a comprehensive metabolic rewiring in the case group compared to controls.

At the core of this metabolic network is the endogenous peptide signaling pathway, which appears to orchestrate a wide array of physiological processes, including neuroendocrine signaling, metabolic regulation, and membrane dynamics. The inferred involvement of lipid metabolism, as suggested by interactions with benzenoids and prenol lipids, indicates a potential feedback loop where lipid-derived signals modulate peptide hormone activity. This interdependence may be crucial in maintaining cellular homeostasis, particularly in tissues with high metabolic demands such as the gastrointestinal tract and nervous system.

Nicotine metabolism emerges as another pivotal module, with its systemic effects extending beyond detoxification. The interplay between nicotine-derived metabolites and vascular function suggests a broader impact on cardiovascular health, potentially mediated through nitric oxide pathways. This aligns with the observed interactions between somatostatin and neuroendocrine signaling, hinting at a compensatory mechanism where nicotine's effects on the nervous system are modulated by peptide hormones.

Folate and purine metabolism are intricately linked, with the former's role in nucleotide biosynthesis and amino acid metabolism providing a foundation for the latter's involvement in DNA and RNA synthesis. The presence of sulfur amino acid metabolism intermediates underscores the interconnectedness of these pathways, highlighting a potential feedback loop that maintains redox balance and methylation reactions. This metabolic coupling is likely critical in rapidly proliferating tissues, where nucleotide demand is high, and may contribute to the altered cellular proliferation observed in the case group.

Steroid hormone biosynthesis and cholesterol metabolism form another axis of metabolic integration, with their shared reliance on lipid substrates and signaling pathways. The inferred presence of metabolites associated with lipid transport and inflammatory signaling suggests a dynamic regulation of steroidogenic activity, potentially influencing immune responses and reproductive processes. This cross-talk may be particularly relevant in tissues such as the adrenal glands and gonads, where steroid hormone production is vital.

The glycerophospholipid metabolism module further underscores the importance of lipid signaling and membrane remodeling in cellular homeostasis. The potential alterations in lipid signaling cascades and energy flux suggest a systemic impact on cellular responses to environmental changes, which could be exacerbated in disease states. This is complemented by the cephalosporin metabolism module, where the interplay between antibiotic detoxification and inflammatory signaling pathways highlights the role of metabolic integration in modulating immune responses.

The dipeptide and oligopeptide metabolism modules reveal the significance of peptide signaling and amino acid recycling in cellular communication and defense mechanisms. The potential interactions with neuropeptide signaling pathways suggest a broader role for these processes in maintaining neural homeostasis and modulating stress responses.

Finally, the furanocoumarin metabolism module highlights the organism's capacity for detoxification and adaptation to environmental stressors. The potential involvement of lipid metabolism and glycosylation reactions underscores the complexity of these pathways, which may protect tissues from phototoxic damage while maintaining cellular integrity.

Collectively, these findings suggest a metabolic phenotype characterized by enhanced signaling and regulatory complexity, with significant implications for tissue-specific functions and organ cross-talk. The structural unknowns within these clusters likely represent novel intermediates or biomarkers, offering new avenues for understanding the underlying mechanisms of the condition. This metabolic rewiring points to a hypothesis where the condition may be driven by dysregulated signaling and metabolic integration, leading to altered cellular homeostasis and disease progression. Further structural elucidation and functional validation of these metabolites will be crucial in unraveling the full extent of these metabolic networks and their role in the condition.",11
"aortic_arch","The integrative analysis of the metabolomic data from the case versus control comparison, utilizing MS2 functional clustering, reveals a complex landscape of metabolic alterations that underscore the interconnectedness of cellular pathways. The identified functional modules, despite being anchored by structurally uncharacterized metabolites, provide a window into the metabolic rewiring associated with the condition under investigation. This systems-level perspective highlights the dynamic interplay between distinct metabolic processes, suggesting a coordinated response to the physiological demands imposed by the condition.

The glutathione metabolism cluster, characterized by metabolites indicative of gamma-glutamyl transferase activity, suggests an upregulation of detoxification pathways in response to oxidative stress. This is complemented by the glycerophospholipid metabolism cluster, where the inferred presence of eicosanoid pathway intermediates points to an enhancement of inflammatory signaling. The interplay between these two modules likely reflects a compensatory mechanism where increased oxidative stress triggers lipid signaling pathways, thereby modulating immune responses and maintaining cellular homeostasis. This cross-talk between antioxidant defenses and lipid-mediated signaling may be particularly relevant in tissues with high metabolic activity, such as the liver, where the detoxification of reactive oxygen species and the modulation of inflammatory responses are critical.

The fatty acid metabolism cluster, with its connections to energy production and nucleotide turnover, further integrates into this metabolic network. The inferred presence of β-oxidation intermediates and nucleoside-related compounds suggests a metabolic shift towards enhanced energy production and nucleotide synthesis, potentially supporting increased cellular proliferation and repair. This metabolic phenotype is indicative of an adaptive response to sustain energy homeostasis and cellular integrity under stress conditions, possibly reflecting the metabolic demands of rapidly proliferating cells or tissues undergoing regeneration.

Xenobiotic metabolism emerges as another critical module, underscoring the body's capacity to process and eliminate foreign compounds. The involvement of NAD+ biosynthesis and phase II conjugation reactions suggests an intricate network of enzymatic activities aimed at safeguarding cellular integrity. This module's functional overlap with glutathione metabolism highlights a broader detoxification strategy, where the liver and gut may play pivotal roles in neutralizing environmental and dietary xenobiotics, thus preventing systemic toxicity.

Lysine degradation, linked to energy production and signaling, integrates with these pathways by contributing to acetyl-CoA production and nitrogen balance. The inferred connections to phospholipid metabolism and redox signaling suggest that lysine degradation may influence membrane dynamics and oxidative stress responses, further aligning with the metabolic demands of tissues such as the brain and liver. This module's integration with energy and lipid metabolism underscores its role in maintaining metabolic balance and responding to physiological changes.

Collectively, these findings delineate an overarching metabolic phenotype characterized by enhanced detoxification, lipid signaling, and energy production, potentially reflecting an adaptive response to oxidative and xenobiotic stress. The tissue-specific effects, particularly in the liver and brain, highlight the organ cross-talk necessary for maintaining systemic homeostasis. The structurally uncharacterized metabolites, inferred through functional clustering, likely represent novel intermediates or biomarkers that could provide further insights into the condition's pathophysiology.

In conclusion, the metabolic rewiring observed in this study suggests a hypothesis wherein the condition induces a coordinated upregulation of detoxification and energy-producing pathways, coupled with lipid-mediated signaling, to counteract oxidative and xenobiotic stress. This integrative metabolic response may be pivotal in sustaining cellular and systemic homeostasis, offering potential targets for therapeutic intervention and biomarker discovery. The uncharacterized metabolites within these clusters present exciting opportunities for future research, potentially unveiling novel pathways and mechanisms underlying the condition.",5
"arteria_carotis","The integration of metabolomics data from our study reveals a complex network of metabolic interactions that underscore a profound systems-level reorganization in the case versus control comparison. At the core of this metabolic phenotype is the intricate interplay between eicosanoid, thiamine, amino acid, glycerophospholipid, beta-lactam antibiotic, cysteine and methionine, and N-acyl amine metabolism. The cross-talk between these functional modules suggests a coordinated response to the underlying condition, characterized by altered inflammatory signaling, energy metabolism, and membrane dynamics.

Eicosanoid metabolism, although devoid of structurally identified metabolites, appears to be a central hub in this network, potentially driving inflammatory responses through prostaglandin signaling. This is further supported by the inferred involvement of glycerophospholipid metabolism, which not only contributes to membrane fluidity but also serves as a reservoir for bioactive lipid mediators. The interaction between these pathways may reflect a compensatory mechanism to modulate inflammatory responses and maintain cellular integrity under stress. Moreover, the presence of prostaglandin-related compounds within glycerophospholipid metabolism suggests a feedback loop that could amplify or dampen inflammatory signaling, depending on the physiological context.

Thiamine metabolism, with its critical role in energy production, intersects with amino acid metabolism, highlighting a potential shift in cellular energy dynamics. The inferred disruption of thiamine-related pathways, coupled with the potential involvement of amino acid derivatives in energy metabolism, suggests a metabolic adaptation to support increased energy demands or to compensate for impaired glycolytic flux. This reprogramming may be particularly relevant in tissues with high metabolic activity, such as the liver or muscle, where energy homeostasis is crucial for maintaining function.

The involvement of beta-lactam antibiotic metabolism, despite the absence of known metabolites, points to an intriguing interaction with cellular stress responses. The potential engagement of pathways that modify beta-lactam antibiotics, along with interactions with nucleotide and peptide metabolism, suggests a broader impact on cellular processes like redox balance and membrane remodeling. This could reflect an adaptive response to antibiotic stress, potentially influencing the efficacy of therapeutic interventions.

Cysteine and methionine metabolism, with its emphasis on redox balance and detoxification, further complements this metabolic landscape. The inferred involvement of glutathione metabolism underscores the importance of antioxidant defenses in managing oxidative stress, which may be exacerbated by inflammatory and energy-related metabolic shifts. The potential cross-talk with N-acyl amine metabolism, which modulates lipid signaling and membrane dynamics, suggests a coordinated effort to maintain cellular homeostasis and respond to external stimuli.

The structural uncharacterization of many metabolites within these clusters presents both a challenge and an opportunity. The functional similarity inferred through MS2 clustering provides valuable insight into their likely biological roles, suggesting that these unknowns may represent novel intermediates or biomarkers of the condition. This highlights the potential for discovering new metabolic pathways or regulatory mechanisms that could be pivotal in understanding disease pathogenesis.

In conclusion, the observed metabolic rewiring suggests a hypothesis where the condition is characterized by a dynamic interplay between inflammation, energy metabolism, and cellular stress responses. This systems-level reorganization reflects an adaptive strategy to maintain cellular function in the face of metabolic perturbations, offering new avenues for therapeutic intervention and biomarker discovery. The integration of these findings into a cohesive narrative underscores the complexity of metabolic regulation and the potential for novel insights into disease mechanisms.",7
"arteria_cruralis","The integrative analysis of our metabolomics data reveals a complex interplay between indole alkaloid biosynthesis and bile acid biosynthesis, suggesting a nuanced metabolic reprogramming in the case versus control comparison. Although both clusters are comprised entirely of structurally uncharacterized metabolites, the functional clustering via MS2 provides compelling evidence of their biological roles, hinting at intricate cross-module interactions and potential compensatory mechanisms that may underpin the observed metabolic phenotype.

The indole alkaloid biosynthesis cluster, despite lacking known metabolite anchors, is functionally enriched with metabolites related to lipid metabolism and signaling pathways. This suggests a systemic adaptation where the biosynthesis of indole alkaloids is potentially supported by lipid remodeling processes. The involvement of glycerophosphoethanolamines and organic acids implies a dynamic interaction with membrane lipid constituents, which may facilitate the synthesis of indole derivatives by providing structural precursors or modulating cellular signaling pathways. This lipid-alkaloid interplay could be crucial for cellular resilience, especially in tissues where rapid signaling and defense responses are necessary, such as in the liver or gastrointestinal tract.

In parallel, the bile acid biosynthesis cluster, also devoid of known metabolites, highlights the complex biochemical transformations that cholesterol undergoes to produce bile acids. The presence of CoA derivatives and transporter activity suggests a finely tuned regulation of bile acid synthesis and reabsorption, critical for maintaining lipid homeostasis. The potential cross-talk between bile acid and indole alkaloid pathways may be mediated through shared intermediates or regulatory feedback loops. For instance, the modulation of lipid metabolism by indole alkaloids could influence cholesterol availability and, consequently, bile acid production, creating a compensatory feedback mechanism to maintain metabolic balance.

The overall metabolic phenotype observed in this study likely reflects a systemic adaptation to a pathological condition, characterized by altered lipid metabolism and secondary metabolite production. This reprogramming could manifest as tissue-specific effects, particularly in organs like the liver and intestines, where bile acid synthesis and reabsorption are critical. The interplay between these functional modules may also indicate organ cross-talk, where metabolic signals from the gut influence hepatic processes and vice versa, potentially impacting systemic cholesterol levels and immune responses.

Embracing the unknowns in our dataset, the structurally uncharacterized metabolites, while enigmatic, provide a fertile ground for discovering novel pathway intermediates or biomarkers. Their functional clustering suggests they play significant roles in the observed metabolic rewiring, potentially representing new targets for therapeutic intervention or disease diagnosis. The unknown metabolites may act as intermediates in yet-to-be-identified pathways, contributing to the synthesis of bioactive compounds that modulate physiological processes.

In conclusion, the metabolic rewiring observed in this study suggests a hypothesis where the interplay between indole alkaloid and bile acid biosynthesis reflects an adaptive response to maintain homeostasis in the face of metabolic stress or disease. This cross-talk may involve compensatory mechanisms that balance lipid metabolism and secondary metabolite production, highlighting the organism's capacity for metabolic flexibility. Understanding these interactions at a systems level provides valuable insights into the underlying mechanisms of the condition, offering potential avenues for future research and therapeutic development.",2
"cecum","The integrative analysis of the case versus control metabolomics data reveals a complex interplay of metabolic pathways, underscoring a systemic metabolic phenotype characterized by enhanced lipid metabolism, altered energy homeostasis, and robust signaling dynamics. This phenotype is primarily driven by the functional clustering of metabolites into distinct yet interconnected modules, each contributing to the overarching metabolic landscape observed in the condition under study.

The acylcarnitine metabolism cluster suggests an upregulation of fatty acid oxidation, a compensatory mechanism likely activated in response to altered energy demands. This is complemented by the glycerophospholipid metabolism cluster, which indicates significant membrane remodeling and signal transduction activity. The interplay between these modules is indicative of a cellular environment striving to maintain energy balance and membrane integrity, particularly under conditions of metabolic stress. The inferred presence of lysophospholipids and phospholipase activity highlights a feedback loop where membrane-derived signaling molecules potentially modulate fatty acid oxidation pathways, aligning with the observed upregulation of acylcarnitine metabolism.

Prostaglandin metabolism further enriches this narrative by suggesting an inflammatory component, with prostaglandin biosynthesis pathways potentially influencing vascular tone and immune responses. This aligns with the sphingolipid metabolism cluster, which, through its involvement in signaling and apoptosis, may modulate inflammatory pathways and cellular stress responses. The potential cross-talk between these lipid signaling pathways suggests a coordinated effort to regulate cellular responses to external stimuli, possibly exacerbating or mitigating disease progression.

The presence of oligopeptide and dipeptide metabolism clusters points to a dynamic protein turnover and nutrient recycling system, essential for maintaining cellular homeostasis. These processes may interact with biotin metabolism, which supports carboxylation reactions critical for fatty acid synthesis and amino acid catabolism. The inferred metabolic cross-talk between these pathways suggests a network of compensatory mechanisms aimed at sustaining metabolic flexibility and energy production, particularly in tissues with high metabolic demands.

The potassium signaling pathway, though less directly related to primary metabolism, underscores the importance of electrolyte balance in maintaining membrane potential and cellular excitability. Its interaction with calcium and magnesium pathways suggests a broader regulatory network influencing muscle contraction and neuronal activity, potentially impacting systemic physiological functions.

The structurally uncharacterized metabolites within these clusters, identified through MS2 functional clustering, represent a frontier of metabolic exploration. Their functional similarity to known metabolites provides valuable insights into their likely biological roles, suggesting they may serve as novel intermediates or biomarkers of metabolic dysregulation. This highlights the potential for discovering new pathway components that could refine our understanding of the condition's pathophysiology.

In summary, the metabolic rewiring observed in this study reflects a condition characterized by enhanced lipid metabolism, altered energy dynamics, and robust signaling pathways. This systemic phenotype suggests a cellular adaptation to metabolic stress, potentially driven by compensatory mechanisms across lipid, protein, and electrolyte metabolism. The interplay of these pathways highlights the complexity of metabolic regulation and offers a hypothesis that the condition may involve a coordinated response to maintain homeostasis in the face of metabolic perturbations. This integrative approach not only enriches our understanding of the disease but also opens avenues for identifying novel therapeutic targets and biomarkers.",12
