"tissue","cluster_id","functional_name","report","feature_count","pmids"
"adipose",1,"Biotin metabolism","Biotin metabolism plays a crucial role in cellular energy production and the synthesis of essential biomolecules. It primarily functions as a coenzyme for carboxylase enzymes, facilitating critical reactions in gluconeogenesis, fatty acid synthesis, and amino acid catabolism. Although no known metabolites anchor this cluster, the presence of functionally related but structurally uncharacterized metabolites suggests involvement in biotin-related pathways. For instance, N-Biotinyl-4-aminobenzoic acid, classified under biotin and derivatives, indicates potential engagement in biotin-dependent enzymatic processes. This compound's presence hints at the modulation of carboxylase activity, impacting metabolic pathways such as the synthesis of fatty acids and the catabolism of branched-chain amino acids. The inferred evidence of N6-Galacturonyl-L-lysine and N2-Galacturonyl-L-lysine, found in both cytoplasm and extracellular spaces, suggests a role in cellular signaling or structural remodeling, possibly influencing carbohydrate conjugation processes. These metabolites, along with 5-(Galactosylhydroxy)-L-Lysine, may participate in glycosylation pathways, which are vital for protein function and stability. Collectively, these functionally related metabolites, though uncharacterized, point towards a complex interplay of biotin metabolism with broader cellular processes, including energy flux and membrane remodeling, highlighting the multifaceted role of biotin in maintaining cellular homeostasis and metabolic flexibility.",13,"34295297,38928282"
"adipose",2,"Steroid hormone biosynthesis","Steroid hormone biosynthesis is a critical biological process involving the conversion of cholesterol into various steroid hormones, which play essential roles in regulating metabolism, immune function, and reproductive processes at the cellular and tissue levels. In the absence of structurally identified metabolites in Cluster 2, our interpretation must rely on inferred functional evidence. The presence of CE(PGE2), classified under steroid esters, suggests involvement in the biosynthesis of steroid derivatives, potentially impacting inflammatory signaling pathways. Elocalcitol, identified as a lipid-like molecule found in blood, may indicate alterations in lipid metabolism or vitamin D analogs, which are crucial for calcium homeostasis and immune modulation. Although Berberrubine and Furomammea G are not directly linked to steroid biosynthesis, their classification as organic compounds and membrane-associated entities, respectively, suggest potential roles in membrane remodeling or as intermediates in steroidogenic pathways. Citbismine F's enteral characterization implies possible gastrointestinal interactions affecting systemic steroid hormone levels. Together, these functionally related but structurally uncharacterized metabolites hint at complex interactions within lipid and steroid metabolism, possibly influencing signaling cascades such as the steroidogenic acute regulatory (StAR) protein pathway or the cytochrome P450 enzyme system, which are pivotal in steroid hormone synthesis and regulation.",15,"31362062,37277481,25465475"
"adipose",3,"Carnitine metabolism","Carnitine metabolism plays a crucial role in cellular energy homeostasis by facilitating the transport of long-chain fatty acids into the mitochondria for β-oxidation, a process that generates ATP. While no known metabolites were identified in Cluster 3, the inferred presence of butenylcarnitine and 3-butenylcarnitine suggests a functional involvement of acyl carnitines, which are pivotal in modulating lipid metabolism and energy flux. Acyl carnitines, such as these inferred compounds, are integral to the carnitine shuttle system, which is essential for the conversion of stored fat into usable energy, particularly under conditions of increased energy demand or metabolic stress. The potential involvement of these functionally related but structurally uncharacterized metabolites in the cluster may indicate alterations in lipid metabolism pathways, possibly reflecting a shift in energy utilization or an adaptive response to treatment or disease conditions in the case group. Additionally, the presence of glycinol-related compounds, although structurally distinct, could imply interactions with signaling pathways related to oxidative stress or inflammation, given the known bioactivities of isoflavonoid derivatives. Overall, the cluster likely represents a functional module involved in the regulation of energy metabolism and lipid processing, possibly influencing broader metabolic and signaling networks within the cell.",10,"23563705,36632072,28508995"
"adipose",4,"Fatty acid ester metabolism","Fatty acid ester metabolism is a crucial biological process that involves the conversion of fatty acids into their esterified forms, which are essential for various cellular functions, including energy storage, membrane structure maintenance, and signaling. Although no known metabolites are directly identified in this cluster, the inferred presence of compounds such as Methyl furfuracrylate and Ethyl 2-furanacrylate suggests the involvement of fatty acid ester derivatives in this functional module. These esters are likely participating in membrane remodeling and energy flux processes, as they are found in the cytoplasm, extracellular space, and membrane regions, indicating their role in cellular compartmentalization and transport. The presence of functionally related but structurally uncharacterized metabolites, such as those resembling Aminohydroxyacetic acid and Furfuryl propyl disulfide, further supports the notion of complex interactions within fatty acid metabolism, potentially influencing pathways related to lipid signaling and structural integrity. Additionally, the involvement of enzymes like Carbohydrate sulfotransferase 3, which interacts with chondroitin 6-sulfate, hints at cross-talk between lipid metabolism and glycosaminoglycan pathways, possibly affecting extracellular matrix composition and cell signaling. Collectively, these processes underscore the multifaceted roles of fatty acid ester metabolism in maintaining cellular homeostasis and responding to metabolic demands or stress conditions.",11,"23791484,26499846,31819192"
"adrenal_gland",1,"Endogenous peptide signaling pathway","The endogenous peptide signaling pathway plays a crucial role in cellular communication, mediating a variety of physiological processes such as hormone release, pain modulation, and metabolic regulation. Despite the absence of structurally identified metabolites in Cluster 1, the inferred functional evidence suggests involvement in key signaling and regulatory functions. For instance, the presence of a polypeptide like Big gastrin indicates potential roles in gastrointestinal hormone signaling, which is critical for digestive processes and cellular growth regulation. The mention of Endomorphin-2, an endogenous opioid peptide, implies a connection to pain modulation and stress response pathways, highlighting the pathway's role in neuropeptide signaling. Although Atglistatin, a benzenoid, is not directly related to peptide signaling, its presence may suggest interactions with lipid metabolism and energy homeostasis, potentially influencing peptide hormone activity. The reference to Acidissiminin, a prenol lipid, further supports the notion of membrane-associated signaling processes, possibly impacting the localization and function of peptide receptors. Collectively, these functionally related but structurally uncharacterized metabolites in Cluster 1 suggest a complex network of peptide-mediated signaling pathways, involving neuroendocrine functions, metabolic regulation, and membrane dynamics, which may be altered in the case group compared to controls.",17,"35836256,35303793,33375317"
"adrenal_gland",2,"Dipeptide metabolism","Dipeptide metabolism is a crucial biological process involved in the breakdown and utilization of dipeptides, which are compounds consisting of two amino acids linked by a peptide bond. This process plays a significant role in protein turnover, nitrogen balance, and cellular signaling. Although no structurally identified metabolites are present in Cluster 2, the inferred functional evidence suggests potential involvement in amino acid and peptide metabolism pathways. The presence of compounds like Cysteinyl-Glutamine and epsilon-(gamma-Glutamyl)-L-lysine implies activity in pathways related to glutathione metabolism and protein modification, respectively. These pathways are essential for maintaining cellular homeostasis, detoxification, and protection against oxidative stress. Additionally, the detection of N5-Acetyl-N2-gamma-L-glutamyl-L-ornithine, primarily located in the cytoplasm and extracellular space, suggests involvement in cellular communication and signaling processes. The functionally related but structurally uncharacterized metabolites in this cluster may participate in similar pathways, contributing to the regulation of metabolic fluxes and cellular responses to environmental changes. Overall, the dipeptide metabolism process is integral to cellular function, influencing various pathways such as amino acid recycling, energy production, and cellular defense mechanisms.",18,"37998326,21880179,37311365"
"adrenal_gland",3,"Oligopeptide metabolism","Oligopeptide metabolism is a critical biological process that involves the synthesis, breakdown, and modification of short chains of amino acids, typically ranging from three to ten residues. These oligopeptides play essential roles in various cellular functions, including signaling, regulation, and structural support. In the context of this cluster, despite the absence of structurally identified metabolites, the inferred presence of compounds like Enkephalin L suggests involvement in neuropeptide signaling pathways. Enkephalins, as oligopeptides, are known for their role in modulating pain and stress responses by interacting with opioid receptors in the nervous system. This indicates that oligopeptide metabolism may be intricately linked to neurochemical signaling and homeostasis. Furthermore, the mention of aminopterin, an organoheterocyclic compound, hints at potential interactions with folate metabolism, possibly influencing nucleotide biosynthesis and cellular proliferation. The functionally related but structurally uncharacterized metabolites in this cluster could be participating in these pathways, contributing to processes such as cellular communication, immune response modulation, and metabolic regulation. Overall, the pathways implicated in this cluster likely include those related to peptide signaling, neurotransmitter regulation, and possibly folate-mediated one-carbon metabolism, underscoring the multifaceted roles of oligopeptides in maintaining cellular and tissue-level homeostasis.",22,"10736319,8524898,40442308"
"adrenal_gland",4,"Steroid hormone biosynthesis","Steroid hormone biosynthesis is a critical biological process that involves the conversion of cholesterol into steroid hormones, which are essential regulators of various physiological functions such as metabolism, immune response, and reproductive processes. At the cellular level, this biosynthesis occurs primarily in the adrenal glands, gonads, and placenta, where enzymes like cytochrome P450s catalyze the conversion of cholesterol into pregnenolone and subsequently into other steroid hormones, including glucocorticoids, mineralocorticoids, androgens, and estrogens. Despite the absence of known metabolites in this cluster, the inferred functional evidence provides a contextual framework to understand the potential involvement of functionally related but structurally uncharacterized metabolites. The presence of compounds like Testololactone, which is measurable in blood and involved in steroid metabolism, suggests an indirect association with steroidogenic pathways. Additionally, other inferred metabolites such as Fluorodopa F 18 and Phaseolotoxin, although not directly linked to steroid biosynthesis, may indicate ancillary processes like amino acid metabolism and peptide signaling that could influence steroidogenic activity. These processes might affect the availability of substrates or cofactors necessary for steroid hormone production. Therefore, while the direct pathway of steroid hormone biosynthesis is not explicitly identified in this cluster, the presence of these functionally related metabolites implies a complex interplay of metabolic and signaling pathways that could modulate steroidogenic functions in the biological context under study.",23,"31362062,37277481,25465475"
"adrenal_gland",5,"Cephalosporin metabolism","Cephalosporin metabolism primarily involves the breakdown and modification of cephalosporin antibiotics, which are crucial in combating bacterial infections. At the cellular level, this process is integral to maintaining the balance between effective antimicrobial activity and the detoxification of these compounds to prevent cellular damage. Although no structurally identified metabolites are present in this cluster, the inferred evidence suggests that the unknown metabolites are functionally related to cephalosporin metabolism. Specifically, the presence of Floridin, classified under cephalosporins, indicates that these metabolites may participate in the hydrolysis and subsequent conversion of cephalosporin compounds, possibly influencing their pharmacokinetics and bioavailability. Additionally, the involvement of metabolites like Loxanast and Bimatoprost, which are associated with organic acids and prostaglandin pathways, respectively, suggests a potential interplay between cephalosporin metabolism and inflammatory signaling pathways. This could imply a role in modulating immune responses during infection treatment. Furthermore, the detection of these functionally related but structurally uncharacterized metabolites in blood highlights their systemic relevance and possible participation in broader metabolic pathways, such as those involved in membrane remodeling and energy flux. Overall, these processes underline the complexity and systemic integration of cephalosporin metabolism, emphasizing its role in both antimicrobial action and the regulation of host physiological responses.",16,"33602825,39069234,39887238"
"adrenal_gland",6,"Folate metabolism","Folate metabolism is a crucial biochemical process that facilitates the transfer of one-carbon units necessary for nucleotide biosynthesis and amino acid metabolism, playing a pivotal role in DNA synthesis and repair, as well as in cellular division and growth. Despite the absence of structurally identified metabolites in this cluster, the inferred functional evidence suggests potential interactions with folate metabolism. Pentaglutamyl folate, although not directly identified, is implicated in cytoplasmic processes, highlighting its role in the intracellular folate pool management, which is essential for maintaining cellular homeostasis and supporting rapid cell proliferation. The presence of S-(6-Purinyl)cysteine, a derivative of cysteine, suggests a link to sulfur amino acid metabolism, which is interconnected with folate pathways through the transsulfuration pathway and methionine cycle. This connection underlines the importance of maintaining redox balance and methylation reactions. Additionally, the classification of 8-Epixanthatin under Xanthanolides, known for their biological activity, may indicate a role in modulating cellular responses or stress pathways. The involvement of ADP-Ribosyl-L-arginine and Orthoperiodic acid, while less directly linked, could suggest broader interactions with cellular signaling and oxidative stress responses. Collectively, these functionally related but structurally uncharacterized metabolites hint at a complex network of interactions within folate metabolism, potentially influencing nucleotide synthesis, amino acid metabolism, and cellular signaling pathways.",20,"38698089,32649885,27641100"
"adrenal_gland",7,"Purine metabolism","Purine metabolism is a critical cellular process involved in the synthesis and degradation of purine nucleotides, which are essential for DNA and RNA synthesis, energy transfer, and cellular signaling. Although no structurally identified metabolites anchor Cluster 7, the inferred evidence suggests involvement in purine-related pathways. Phosphoribosyl formamidocarboxamide, a compound related to 1-ribosyl-imidazolecarboxamides, suggests activity in the purine biosynthesis pathway, particularly in the formation of inosine monophosphate (IMP), a precursor for adenine and guanine nucleotides. The presence of Glycineamideribotide, associated with AICA-Ribosiduria and Gout, indicates disruptions in purine salvage pathways, potentially leading to an accumulation of precursors and intermediates. Additionally, 6-Azauracil, found in body fluids, may reflect alterations in nucleotide turnover or catabolism. The involvement of 5-Methylthioribulose 1-phosphate, a glycerone phosphate, hints at interconnectedness with methionine salvage pathways, which could influence cellular methylation states and energy metabolism. These functionally related but structurally uncharacterized metabolites suggest a complex interplay between purine synthesis, salvage, and degradation pathways, possibly contributing to altered nucleotide pools and associated pathophysiological conditions in the case group. Overall, this cluster highlights the dynamic regulation of nucleotide metabolism and its potential impact on cellular function and disease states.",16,"38823389,34767747,35964092"
"adrenal_gland",8,"Nicotine metabolism","Nicotine metabolism is a crucial biological process that involves the conversion of nicotine into various metabolites, primarily occurring in the liver, but also impacting cellular and tissue function throughout the body. Although no structurally identified metabolites are present in this cluster, inferred evidence suggests significant involvement of the Nicotine Action and Nicotine Metabolism Pathways. Cotinine and its derivative, Cotinine N-oxide, play central roles in these pathways, serving as primary metabolites of nicotine. These compounds are involved in the detoxification and clearance of nicotine, with Cotinine N-oxide measurable in the blood, indicating systemic distribution and processing. The presence of L-arginine, a precursor in the production of nitric oxide, suggests potential interactions with pathways regulating vascular function and neurotransmission, possibly influenced by nicotine's known effects on the nervous system. The functional descriptions also highlight the interaction of somatostatin with cysteamine, hinting at a modulatory role in neuroendocrine signaling. Collectively, these insights suggest that the cluster may represent a functional module involved in nicotine detoxification, systemic circulation, and its broader physiological effects, including vascular and neurological modulation. The presence of functionally related but structurally uncharacterized metabolites further supports the complexity and systemic impact of nicotine metabolism, underscoring the need for further structural elucidation to fully understand their roles within these pathways.",32,"15734728,19184645,18834313"
"adrenal_gland",9,"Furanocoumarin metabolism","Furanocoumarin metabolism is a critical biological process predominantly involved in the detoxification and modification of furanocoumarins, compounds often found in plants that can affect human health through their interaction with cellular components. Although no known metabolites anchor this cluster, the inferred functional evidence suggests a potential role in skin and subcutaneous tissue disorders, as indicated by the similarity to 9-Hydroxy-4-methoxypsoralen, a furanocoumarin derivative. This process likely involves the activation of metabolic pathways that modify these compounds to reduce their phototoxic effects, which can cause cellular damage upon exposure to ultraviolet light. The presence of functionally related but structurally uncharacterized metabolites, such as those resembling fatty acyls, phenolic glycosides, diterpenoids, and sesquiterpenoids, suggests a complex interplay of pathways that may include lipid metabolism, glycosylation reactions, and terpenoid biosynthesis. These pathways could be involved in the modulation of membrane integrity, energy storage, and signaling cascades that respond to environmental stressors. The metabolic transformation of furanocoumarins may also intersect with detoxification pathways, such as those mediated by cytochrome P450 enzymes, which are known to play a role in the oxidative metabolism of xenobiotics. Collectively, this cluster highlights the intricate network of biochemical reactions that protect tissues from the potentially harmful effects of furanocoumarins while maintaining cellular homeostasis.",14,"18538731,33601415,36858045"
"adrenal_gland",10,"Glycerophospholipid metabolism","Glycerophospholipid metabolism is a vital cellular process that involves the synthesis, remodeling, and degradation of glycerophospholipids, which are essential components of cellular membranes. This metabolic pathway plays a critical role in maintaining membrane integrity, fluidity, and the generation of lipid signaling molecules. Although no known metabolites are identified in this cluster, the functional module's association with glycerophospholipid metabolism suggests involvement in processes such as membrane remodeling and signal transduction. The inferred presence of compounds like 1,2-Diacylglycerol-LD-PS-pool and 1,2-Diacylglycerol-LD-PE-pool, despite their structural ambiguity, indicates potential participation in the synthesis or turnover of phosphatidylserine and phosphatidylethanolamine, respectively. These lipids are crucial for cellular processes such as apoptosis and cell signaling. Additionally, the mention of PGP(5-iso PGF2VI/i-16:0) within the class of fatty acyls suggests a link to the generation of lipid mediators involved in inflammatory signaling pathways. The presence of functionally related but structurally uncharacterized metabolites in this cluster could imply alterations in lipid signaling cascades or energy flux, potentially impacting cellular responses to treatment or disease states. Together, these insights underscore the importance of glycerophospholipid metabolism in cellular homeostasis and its potential modulation under varying biological conditions.",10,"35108060,37992400,36131016"
"adrenal_gland",11,"Cholesterol metabolism","Cholesterol metabolism is a critical biological process that involves the synthesis, uptake, transport, and elimination of cholesterol within cells and tissues. This process is essential for maintaining cellular membrane integrity, hormone synthesis, and bile acid production. Although no structurally identified metabolites are present in Cluster 11, the inferred evidence suggests a functional module related to cholesterol metabolism. The presence of cholesteryl esters, such as CE(22:6(4Z,7Z,10Z,13E,15E,19Z)-OH(17)), indicates active lipid transport and storage processes. Cholesteryl esters are integral in the formation of lipoproteins, which are crucial for cholesterol transport through the bloodstream. The involvement of lipid-like molecules, as inferred from 15-oxo-5S,6R-dihydroxy-7E,9E,11Z,13E-eicosatetraenoic acid, suggests potential roles in inflammatory signaling pathways, which are often linked to cholesterol metabolism and cardiovascular health. The presence of functionally related but structurally uncharacterized metabolites in body fluids and cellular membranes indicates dynamic interactions within the extracellular matrix and membrane remodeling processes. These interactions might influence the regulation of cholesterol homeostasis and its associated pathways, such as the mevalonate pathway and steroidogenesis. Overall, the cluster's composition points to a complex network of lipid metabolism and signaling, underscoring the interconnectedness of cholesterol metabolism with broader physiological functions.",13,"31848472,33272367,37706071"
"aortic_arch",1,"Xenobiotic metabolism","Xenobiotic metabolism is a critical biological process that involves the biochemical modification of foreign compounds, such as drugs, environmental pollutants, and dietary substances, to facilitate their excretion from the body. This process primarily occurs in the liver but is also active in other tissues, including the intestines and kidneys. Although no structurally identified metabolites anchor this cluster, the inferred evidence suggests the involvement of various metabolic pathways. For instance, the presence of compounds functionally related to pyridine nucleotides, such as beta-nicotinate D-ribonucleotide, indicates a potential link to NAD+ biosynthesis and redox reactions, which are essential for detoxifying xenobiotics. The identification of cyanuric acid, an environmental contaminant, underscores the role of xenobiotic metabolism in processing and neutralizing potentially harmful substances. Additionally, the presence of organooxygen compounds, such as (5-acetamido-3,4,6-trihydroxyoxan-2-yl)methyl dihydrogen phosphate, suggests involvement in phase II conjugation reactions, which enhance the solubility of xenobiotics for excretion. Functionally related but structurally uncharacterized metabolites, such as those associated with enteral systems, point towards the gut's role in xenobiotic processing. Collectively, these pathways highlight the complex network of enzymatic reactions that safeguard cellular integrity and maintain homeostasis in the face of external chemical challenges.",14,"28642381,36768362,38541726"
